topic	title	subtitle	texts
Emergenze sociali	SFRATTATO SFONDA UTERO IN AFFITTO C’è entrato colla famiglia e tutto!	Se la cosa piglia piede, fra poìno ‘un ci sarà più un buo libero!	È successo tutto in du’ balletti. Lo sfrattato è arrivato davanti all’utero in affitto, cià levato ‘r cartello «Affittasi a coppie ghèi e artre gente senza figlioli» e ce n’ha messo un  artro ‘ndove ciaveva scritto «Io ‘nvece di figlioli ce n’ho tre belli piccini e affamati fissi, ortre alla mi’ moglie che anc’a lei l’appetito ‘un ni manca, la mi’ socera che ‘un si riempie mai quer popò di lotro e perfino ‘r gatto che lui però s’arrangia co’ topi sennò a quest’ora l’avevo bell’e volato». Poi ha dato ‘na pedata all’uscio e sono entrati tutti dentro, gatto compreso, che lui tutto quell’odore di topa ‘un l’aveva mai sentito e miagolava parecchio ‘nteressato. Sicché si sono sistemati alla meglio,  co’ materassi per la terra, un po’ di ciottoli accatastati sur un tavolino e un vaso da notte per i bimbi, per ‘un falli piscià a giro…(Continua la lettura sul Vernacoliere in edicola, oppure  acquistalo scaricando la App gratuita del Vernacoliere dall’App Store per iOS, o da Google Play per Android).
Riforma Madia Forestale e Benemerita doventano tutt’uno!	CARABINIERE ARRESTA ARBERO	che ‘un si voleva scanzà da un incendio!	– Gaò, o cosa vorrà dire?! – ha stronfiato ‘r generale, che lui è pisano e l’hanno fatto perappunto generale dopo che ’na sera lo trovarono tutto appoggiato alla Torre per arrestà la caduta. E si rigirava fra le mani quell’informativa che diceva come quarmente di lì a pòo la Benemerita e la Forestale sarebbero doventati tutt’uno. – Stai a vedé ci toccherà spenge’ l’incendi anc’a noi carabinieri! Ir che a dire ‘r vero ni sconfinferava pòo, ma uso a obbedir tacendo ‘un ha fatto discorzi: – O giù, qui bisogna preparassi ammodo! Sicché dé, immediato ordine di servizio perentorio, coll’ordine tassativo d’esercitassi tutti a fa’ ‘ pompieri!…(Continua la lettura sul Vernacoliere in edicola, oppure  acquistalo scaricando la App gratuita del Vernacoliere dall’App Store per iOS, o da Google Play per Android).
L'editoriale - Senza peli sulla lingua	IL CALLO E L’INTOLLERANZA		Si dice “farci il callo”, di qualcosa alla quale ormai ci siamo abituati. Rassegnati, quasi. Non facendoci più gran caso, ormai. Come per i massacri di grandi e di piccini nella quotidiana routine non solo di questa terza guerra mondiale frammentata in stragi d’eserciti cosiddetti regolari e di bande cosiddette terroriste, ma routine anche di diuturni annegamenti in mare di chi fugge da quelle stragi, con la televisione a dirci un giorno dopo l’altro di tanti altri nuovi affogati, bimbi specialmente. E col callo di quell’abitudine cerchiamo allora sul telecomando un’altra rete che non ci dia più tanto fastidio, al momento del mangiare soprattutto, te lì con la forchetta in mano e il telegiornale a dirti anche oggi un sacco di disperati spariti nell’onde, una quindicina erano bimbini. E se non spippoli di rincorsa rischi l’appetito… (Continua la lettura sul Vernacoliere in edicola, oppure acquistalo scaricando la App gratuita del Vernacoliere dall’App Store per iOS, o da Google Play per Android).
	La presentazione di Febbraio		In una veloce sintesi il direttore del Vernacoliere, Mario Cardinali, presenta il suo editoriale e i suoi pezzi satirici sul Vernacoliere di febbraio 2016. Il Vernacoliere è in vendita nelle edicole di tutta la Toscana e in parte di quelle dell’Umbria, del Lazio, della Lombardia, del Piemonte e del Veneto, oppure disponibile scaricando la App gratuita del Vernacoliere su App Store e su Google Play.
Riforma costituzionle Un uomo solo al comando Un grido possente percorre l'Italia:	RENZI RENZI ALALÀ!	La gioventù accorre compatta al PARTITO NAZIONALE RENZISTA	di Mario Cardinali Al fulgido sorgere del nuovo Sole d’Italia i vili grillini già si ringuattano nell’ombra, eversori di pavida nicchia, i più pericolosi cercando già le vie di Lugano e di Parigi. Ma vigile su loro s’è subito protesa la mano della Milizia Popolare Renzista, al virile comando di Andrea Romano, vincitore nella patriottica gara per l’altissima poltrona con donna Serracchiani, renziana sì di fervida fede anch’essa, ma pur sempre donna. E mentre anche sparuti figuri d’anarchia vengono avviati al confino isolano, chiusi nel loro livore di libero pensiero, risuona per le vie e le piazze d’Italia un solo possente grido di fede e di passione: RENZI RENZI ALALÀ! a ricordare nell’empito di combattivo orgoglio quell’EIA EIA ALALÀ!  che fu già il grido di battaglia e d’incitamento degli antichi greci prima, e degli eroici incursori di D’Annunzio e degl’impavidi arditi di Mussolini poi.(Continua la lettura sul Vernacoliere in edicola, oppure  acquistalo scaricando la App gratuita del Vernacoliere dall’App Store per iOS, o da Google Play per Android).
Pubbrica Amministrazione	LICENZIATO IMPIEGATO SORPRESO COLL’UCCELLO IN MANO!	Ma lui si difende: 'UN ERA 'R MIO!	Il direttore è arrivato come al solito verso l’undici. – Tutto a posto, signorina? – ha chiesto alla segretaria. – Oggi un po’ meglio, direttore! Ne manca soltanto diciassette! – In malattia? – No no, timbrato il cartellino e via! – Eh, sempre a fassi ‘ ‘azzi sua, questi sfaccendati! – A proposito di ‘azzi, direttore, c’è Gargiulo l’ho trovato coll’uccello in mano! Ma no per modo di dire, propio uccello uccello! Una popò di fava, pareva un palo! – ha precisato la segretaria, che in quell’uffici di fave n’ha viste sempre tante, ma grosse a quel modo mai!…(Continua la lettura sul Vernacoliere in edicola, oppure  acquistalo scaricando la App gratuita del Vernacoliere dall’App Store per iOS, o da Google Play per Android).
Lavoro Nuova possibilità per i giovani	ACCOMPAGNATORI DI CANI STITICI	da sollecità grattandoni 'r culo ar momento giusto	“Guardate sereni al futuro!”. Con queste eccitanti parole del premier Renzi è stato solennemente inaugurato l’altro giorno il “Corso d’addestramento per accompagnatori di cani stitici”, che come nei fattivi piani del Governo offrirà a tanti ragazzi e ragazze una nuova possibilità d’inserirsi nel mondo del lavoro…(Continua la lettura sul Vernacoliere in edicola, oppure  acquistalo scaricando la App gratuita del Vernacoliere dall’App Store per iOS, o da Google Play per Android).
L'editoriale - Senza peli sulla lingua	ONESTO SARÀ LEI!		Altri tempi davvero, quando si diceva “il più pulito cià la rogna”, a popolarmente significare che non ce n’erano anime belle, fra quanti in qualche modo detenevano un potere, economico o politico o professionale che fosse, o comunque vi partecipavano. Ed altri tempi anche quando venne “questo mondo di ladri” cantato da Venditti, nella certificazione anche musicale d’una disonestà civile e incivile ormai allargata a un po’ tutta la società, una colpa generale divenuta regola comune. E poiché le regole comuni fanno infine la normalità del testo, ecco infine Craxi a teorizzare in tribunale, Mani pulite processante, quel “tutti ladri, nessun ladro” che della colpa faceva assolutoria regola generale. Fin poi – inchiesta Mani pulite passata e sepolta –  a divenire, da regola generale, titolo di meritoria qualità. Da cui la satira sullo sdegnatissimo parlamentare che urla a un collega “Lei è un onesto!”, e lui risponde altrettanto sdegnato “Onesto sarà lei!”. Ecco, pare infine questo il succo della grande offensiva renziana – di Renzi in persona e della sua corte in fervente schiera – contro i 5Stelle incappati nel caso di Quarto…  (Continua la lettura sul Vernacoliere in edicola, oppure  acquistalo scaricando la App gratuita del Vernacoliere dall’App Store per iOS, o da Google Play per Android).
	La presentazione di Gennaio		In una veloce sintesi il direttore del Vernacoliere, Mario Cardinali, presenta il suo editoriale e i suoi pezzi satirici sul Vernacoliere di gennaio 2016. Il Vernacoliere è in vendita nelle edicole di tutta la Toscana e in parte di quelle dell’Umbria, del Lazio, della Lombardia, del Piemonte e del Veneto, oppure disponibile scaricando la App gratuita del Vernacoliere su App Store e su Google Play.
Banca Etruria Maria Elena è salva!	L’UNESCO: IL CULO DELLA BOSCHI PATRIMONIO DELL’UMANITÀ	Ora 'un la possano più toccà!	
Dopo Livorno	GRILLO SCRIVE ALLA SU’ FAVA “Sei una testadiazzo, ‘un m’ubbidisci più!”	ESPELLERÀ ANCHE LEI?	E ora Grillo ha sospeso addirittura la su’ fava! «Lei – c’è scritto nella meil che alla fava niel’ha mandata lo staffe propio di Grillo, che vabbene loro danno del lei a tutti, ma ir sentillo dare anche a ‘na ‘na fava fa capì tutta la gravità della situazzione – lei ha violato in modo grave, ripetuto e sostanziale i principi fondamentali der Movimento  Cinquestelle, ‘ndove lei oramai ‘un si move guasi più, e allora cosa ci sta a fa’? » La fava dé, c’è rimasta bigia! Sicché ha telefanato di volata a Grillo: – Beppe, ma mi dici ‘sa t’ho fatto?! Vabbene  ti sto sulle palle, ma magari ‘na spiegazzione ammodo…(Continua la lettura sul Vernacoliere in edicola, oppure  acquistalo scaricando la App gratuita del Vernacoliere dall’App Store per iOS, o da Google Play per Android).
Obbrigazzioni subordinate	PENZIONATO TRUFFATO VIOLENTA DIRETTORE DI BANCA PERDIDIETRO	Ora tutti i direttori a buostrinto!	Tempo addietro c’era stato un penzionato che dop’avé  ritirato du’ risparmi ‘n banca allo 0,01 percento, s’era messo a mantrugiassi l’uccello davanti a tutti! E all’impiegato che n’aveva chiesto sbalordito «o cosa fa?!»,  n’aveva risposto «dé, co’ vostri ‘nteressi mi ci fo le seghe!». E tutte le perzone perbene dai a brontolà ora basta, bisogna mette’ un freno a questi penzionati senza più ritegno! Discorsi ritornati paripari a galla ora che un artro penzionato che n’avevano fatto ‘nvestì tutti i su’ risparmi in obbrigazzioni subordinate, tipo quelle della Banca Etruria per capissi, s’è ritrovato anche lui senza più ‘na lira! Ma ‘nvece di fa’ le dimostrazzioni co ‘artelli per la strada come tutti vell’artri poveracci rovinati dall’Etruria, lui ha preso ‘r direttore della su’ banca per il collo!…(Continua la lettura sul Vernacoliere in edicola, oppure  acquistalo scaricando la App gratuita del Vernacoliere dall’App Store per iOS, o da Google Play per Android).
L'editoriale - Senza peli sulla lingua	LE MANI NELLA SPAZZATURA		Ora sì che, magari a livello locale, la politica s’è alzata di livello! C’è voluto il caso Aamps, l’azienda municipalizzata dei rifiuti livornese, a ridar tono e spessore alle discussioni fra partiti. Con colte e documentate disquisizioni sul perché quell’Aamps sia giunta oggi al quasi fallimento, dopo tant’anni d’indisturbata amministrazione della “sinistra” cosiddetta. Colte e documentate argomentazioni per spiegare perché – alle accuse a quella cosiddetta sinistra d’aver per decenni mantenuto con continue iniezioni di mutui e rifinanziamenti e accumulo di debiti a carico della cittadinanza una fabbrica anche di poltrone e di sicuri voti – il Pd d’oggi risponde autorevolmente con la derisione dell’avversario, quei “principianti venuti dal web”, com’ha titolato per esempio la serissima Unità, quelli livornesi accomunati nelle “prove disastrose dei governi locali a guida grillina”. Girando insomma e semplicemente la frittata, col rivolgere ai 5 Stelle le accuse di parentopoli e poltronifici che invece si son sempre fatte – nel caso livornese – a chi per settant’anni ha guidato la città …  (Continua la lettura sul Vernacoliere in edicola, oppure acquistalo scaricando la App gratuita del Vernacoliere dall’App Store per iOS, o da Google Play per Android).
	La presentazione di Dicembre		In una veloce sintesi il direttore del Vernacoliere, Mario Cardinali, presenta il suo editoriale e i suoi pezzi satirici sul Vernacoliere di dicembre 2015. Il Vernacoliere è in vendita nelle edicole di tutta la Toscana e in parte di quelle dell’Umbria, del Lazio, della Lombardia, del Piemonte e del Veneto, oppure disponibile scaricando la App gratuita del Vernacoliere su App Store e su Google Play.
Guerra all’Isis!	PRONTE LE TESTE DI CAZZO DELLA LEGA	I tremendi incursori sbarcheranno in Siria sui Carrocci anfibi! Già scappato Abuabbà!	di Mario Cardinali Come s’è sparsa la notizia, un brivido d’orrore ha percorso ‘r mondo: scendano ‘n campo – anzi in mare – le Teste di Cazzo della Lega! E sai, Teste di Cazzo vere,  mìa le solite Teste di Coio che ‘un capiscan nulla! Incursori feroci, guastatori rotti a tutti i rischi, òmini armati fino a’ denti, anzi fino alla testa, con quer su’ spaventoso ermo colle ‘orna ‘n capo, e lo spadone d’Arberto di Giussano ‘n mano! Gente dura, padani tirati su a acqua der Po e erba dell’arpeggi,  montanari avvezzi a rompe’ a testate le rocce anche più dure, gente der norde che te ni pòi anche spenge’ la luce all’improvviso ma tanto loro sono abituati a andà a tentoni nella nebbia e la strada di ‘asa la ritrovan sempre!…(Continua la lettura sul Vernacoliere in edicola, oppure  acquistalo scaricando la App gratuita del Vernacoliere dall’App Store per iOS, o da Google Play per Android).
Pissiòsi terrorismo Paura a Livorno!	MUSSURMANA SI LEVA ‘R VELO DALLA POTTA	e se la sventola all’improvviso fra la gente! STECCHITI 12 VECCHIETTI!	Mercato Centrale di Livorno, ore 10,30. È un’afosa giornata d’autunno. Fra le tante gente in fila ai banchi, una donna araba cor su’ tìpio gonnellone lungo fino a’ piedi comincia tuttantratto a smanià,  a dire oiòi che cardo, mi sento mancà ‘r fiato, mi suda anche la topa… E all’improvviso zà, s’arza ‘r gonnellone, si leva con gesto rapido il velo dalla pòtta e principia a sventolassela e a dire ah bene, ‘un ne potevo più! Ma dire così e principià la strage, è stato un attimo sortanto!…(Continua la lettura sul Vernacoliere in edicola, oppure  acquistalo scaricando la App gratuita del Vernacoliere dall’App Store per iOS, o da Google Play per Android).
GIUBILEO Prime misure di siurezza	A SANPIETRO VIETATE LE SCURREGGE FORTI	Si potrebbe penzà  a uno scoppio terrorista!	Dé, l’artro giorno s’è sentita davanti alla Chiesa di San Ginocchio Gonfio una botta bella forte, sicché stoppe alla messa di volata e tutti fori a urlare aiuto i terroristi! E prima di capì che era stato sortanto lo scoppio d’una gomma, più d’uno fra ‘ fedeli s’era già caato addosso! Dé, a vorte si dice ‘r caso! – Aspetta un po’! – ha penzato difatti ‘r capo der Comitato Per Non Lasciacci le Coia Perdavvero ar Giubileo, corpito propio dall’accostamento fra chiesa, fedeli, scoppio e caamento addosso! – Qui bisogna ‘ntervenire di volata!(Continua la lettura sul Vernacoliere in edicola, oppure  acquistalo scaricando la App gratuita del Vernacoliere dall’App Store per iOS, o da Google Play per Android).
L'editoriale - Senza peli sulla lingua	IL TERRORE È DI TUTTI		Io mi ricordo per esempio anche il nostro, di terrore, quello dei livornesi sfollati nelle campagne pisane, in fuga dai bombardamenti a tappeto americani del ’43. Noi bimbettini no, beata incoscienza di chi trova il modo di giocare anche nella guerra. Ma gli urli d’òmini e di donne sotto il fitto cannoneggiamento delle truppe Usa in avanzata nel ’44 li rammento bene, in quel rifugio scavato a mano nella terra collinosa di Bùcini, un po’ fuori di Fauglia, un gruppetto di famiglie rimpiattate in capanne di frasche per non farsi beccare dai tedeschi. E le donne più di tutto urlavan di terrore, le mamme coi bimbi abbracciati a mucchio, mentre il terriccio ci cadeva addosso col rintronare degli scoppi. E poi ricordo il mi’ babbo buttato di picchio a coprire me e la mi’  sorellina, scaraventati nel fosso d’un campo dove in quell’estate…  (Continua la lettura sul Vernacoliere in edicola, oppure  acquistalo scaricando la App gratuita del Vernacoliere dall’App Store per iOS, o da Google Play per Android).
	I NUOVI GADGETS DEL VERNACOLIERE		I NUOVI GADGETS DEL VERNACOLIERE Magliette, tazze, spille, magneti, accendini e tanto altro. http://shop.vernacoliere.com
L'editoriale - Senza peli sulla lingua	ORA SI CAMBIA DAVVERO		Sarà pur piccolo, il Comune di Sanremo, ma è di certo l’esempio di tanto ben più grande malaffare istituzionale. Quelle frotte d’impiegati assenteisti – anche con i colleghi a timbrar per loro i cartellini, poi pensabilmente ricambiati – e quei dirigenti che pur con gli uffici vuoti pare non s’accorgessero di nulla, non solo replicano quanto altre volte s’è visto venir fuori nel pubblico impiego, ma anche esprimono a livello locale una complicità di sistema – un concorso comunque nella frode – che a livello nazionale può rapportarsi a quel grande concorso esterno in associazione politico-affaristica che tanto caratterizza le nostra vita istituzionale…(Continua la lettura sul Vernacoliere in edicola, oppure  acquistalo scaricando la App gratuita del Vernacoliere dall’App Store per iOS, o da Google Play per Android).
	La presentazione di Novembre		In una veloce sintesi il direttore del Vernacoliere, Mario Cardinali, presenta il suo editoriale e i suoi pezzi satirici sul Vernacoliere di novembre 2015. Il Vernacoliere è in vendita nelle edicole di tutta la Toscana e in parte di quelle dell’Umbria, del Lazio, della Lombardia, del Piemonte e del Veneto, oppure disponibile scaricando la App gratuita del Vernacoliere su App Store e su Google Play.
VUOI FARE CARRIERA? Partecipa al Grande Concorso	LECCA ANCHE TE IL CULO A RENZI	Più lecchi e più vinci posti in politica, nei giornali, alla Rai e su tante altre poltrone di successo! Anche leccate di gruppo!	Ir vero probrema è che Renzi cià un culo solo, e chi nielo vole leccà sono millioni! Mapperò la Serracchiani ha già penzato a tutto: ‘r culo dell’amato Prèmie potrà esse’ leccato anche ‘n fotografia! Dettofatto, ecco già pronte millioni di fotografie cor culo di Renzi tutto sorridente, che per ora ni serviranno a’ partecipanti ar novo Grande Concorso per fa’ carriera dappertutto, ma poi torneranno bone anche ne’ gazzebi di quest’artre amministrative, ‘ndove finarmente le primarie der Piddì potranno esse’ non più sortanto primarie der cazzo ma anche primarie der culo. Oddìo, ‘un è che ’l leccheggio der culo di Renzi sia ‘na novità, è sempre esistito che ‘r vincitore ciabbia i su’ vassalli a lingua ‘nfori! E lui cià rifatto un Piddì ‘ntero con quer sistema lì, ortre a formacci anche un Governo! Ma mentre prima ’r metodo leccatorio era piuccheartro un’inizziativa di chi si voleva mantené ‘r posto ner partito o sistemassi un po’ meglio anche lui da quarche parte, ora ‘nvece è doventato addirittura un Concorso di Stato lanciato perapposta dar Governo der Prèmie Renzi – che guai a di’ sortanto Prèmie o sortanto Renzi, ti levano subito ‘r posto ne’ telegiornali – nella su’ continua ricerca di nove opportunità per l’italiani e speciarmente i giovani, per danni un futuro di radiosa speranza… (Continua la lettura sul Vernacoliere in edicola, oppure  acquistalo scaricando la App gratuita del Vernacoliere dall’App Store per iOS, o da Google Play per Android).
Guardia der corpo frettolosa	SI METTE BRUNETTA IN TASCA	e se lo scorda ne' pantaloni! È finito in lavatrice!	Quando l’hanno tirato fori dalla lavatrice, più che Brunetta era un Brunettino! Un cosino tutto strizzato, centrifugato assieme all’artri panni, che coll’occhi ‘nfori strillava «comunisti, sono stati i comunisti!» E ‘nvece no, era stata una su’ guardia der corpo, un bodiguàrde! Che quer giorno, ‘nvece di mette’ Brunetta ‘n macchina come sempre, se l’era ficcato nella tasca de’ pantaloni! Dice ma come, e te uno come Brunetta te lo ficchi ‘n tasca?! Dice dé, mi c’entrava!… Derresto, – ha seguitato a spiegassi ‘r bodiguàrde davanti alla Commissione contro i Rimpiattamenti de’ Pezzigrossi in Posti che ‘nvece son Piccini – ho dovuto fa’ alla sverta! C’era uno che arrivava tutto di rincorza propio verso l’onorevole, mancapòo lo stiaccia!…(Continua la lettura sul Vernacoliere in edicola, oppure  acquistalo scaricando la App gratuita del Vernacoliere dall’App Store per iOS, o da Google Play per Android).
I grandi dubbi del Sinodo irrisolti	DUE PRETI CHE S’INCHIAPPETTANO	fanno un'unione civile o religiosa? E i due possono adottare un chierichetto?	Que’ due erano lì a rinculassi,  tuttantratto arriva ‘r Cardinale! – O voi ‘sa fate?! – Dé, un’unione religiosa! Che lipperlì ‘r Cardinale ha detto tò, ‘un ciavevo mai penzato, e ha portato ‘r caso davanti ar Sinodo! E lì è scoppiato ‘r casino! – Unione religiosa ‘na sega! – ha subito osservato ‘r capo della corrente conservatrice. – Sia come sia, due che se lo buttano ner caapranzi  è sempre un’unione civile! – Beh, civile dipende! – ha obbiettato ‘r capo della corrente ‘nvece progressista. – Se ‘un adoperi magari nemmeno un po’ di sputo…(Continua la lettura sul Vernacoliere in edicola, oppure  acquistalo scaricando la App gratuita del Vernacoliere dall’App Store per iOS, o da Google Play per Android).
Dal 29 ottobre all' 1 novembre	Le nostre novità		
	Staino e Cardinali		Sergio Staino ride con Mario Cardinali, direttore del Vernacoliere, al Festival “Il senso dell’umorismo” svoltosi a Livorno dal 25 al 27 settembre.
	Il Vernacoliere a Lucca Comics		Il Vernacoliere vi da appuntamento anche quest’anno a “Lucca Comics” dal 29 ottobre all’1 novembre
Un'artra rivoluzzione der Papa!	I PRETI DEVANO LAVORÀ	Ma la categoria 'un ci sta!  SCIOPERO DELLE MESSE!	– Basta con questa Chiesa d’affaristi e di ricchi sfondati, basta coll’inculà i bimbetti, basta collo Iòrre che ricicra i milliardi della mafia, basta colle parrocchie che ‘un accorgano l’immigrati, basta coll’arberghi religiosi che ‘un pagano le tasse…»Discorsi e basta, vabbene, ma perintanto quarcuno fra ‘ fedeli ci crede perdavvero, e anche ‘n Vatiano c’è gente ni darebbe fòo, a questo papa che vor mette’ sottosopra tutto!Capirai, cià messo sèoli la ‘Iesa a doventà ‘na potenza mondiale no sortanto di fede ma anche di vaìni, e ora vesto Francesco viene a dire basta a tutto!E quando alla fine l’artro giorno ha detto addirittura basta co’ preti che si fanno le seghe, allora sì che anche nelle parrocchie si sono risentiti ‘n tanti!…(Continua la lettura sul Vernacoliere in edicola, oppure  acquistalo scaricando la App gratuita del Vernacoliere dall’App Store per iOS, o da Google Play per Android).
	La presentazione di Ottobre		In una veloce sintesi il direttore del Vernacoliere, Mario Cardinali, presenta il suo editoriale e i suoi pezzi satirici sul Vernacoliere di ottobre 2015. Il Vernacoliere è in vendita nelle edicole di tutta la Toscana e in parte di quelle dell’Umbria, del Lazio, della Lombardia, del Piemonte e del Veneto, oppure disponibile scaricando la App gratuita del Vernacoliere su App Store e su Google Play.
BASTA COLL'INGRESE!	PER LA TOPA LA NOSTRA LINGUA È MEGLIO!	L'Accademia della Crusca: SE LA SOGNANO L'INGRESI LA POTTA!	E quando lui n’ha spiegato che lui voleva sortanto dire topa mapperò in ingrese, lei n’ha detto deliata «allora parla come mangi, stronzolo!»O sennò come quella ragazza che sere addietro caminava sur viale per i fatti sua. L’abborda  uno ‘n macchina di fori, ni fa:– Seddercaso escort, come ortre a tu’ ma’ e alla tu’ sorella l’ha sempre fatta anche la tu’ grammòdar!…(Continua la lettura sul Vernacoliere in edicola, oppure  acquistalo scaricando la App gratuita del Vernacoliere dall’App Store per iOS, o da Google Play per Android).
Immigrati	NERO VOLE LA STAMPELLA  PER L’UCCELLO!	'Un ce la fa più a tenello su!  SARVINI:  PRIMA L'UCCELLI ITALIANI! Assieme s'arraffa meglio!	Quando l’hanno visto scende’ dar barcone con quer popò di gonfiore davanti, dice vai, sono ‘n due!– ‘Sa ciai lì sotto? – n’ha chiesto difatti ‘r pulizziotto ‘nsospettito. – Un bimbino?– No bimbino! Guesto mio uggello! – n’ha risposto ‘r senegalese, e l’ha tirato fori!– Un missile dell’Isis, un missile dell’Isis! – tutti a urlà, e tutti a buttassi per la terra colle mani ‘n capo!E ‘nvece no, era propio l’uccello di quer nero! Che come i pulizziotti si sono riavvicinati pianopiano per guardallo meglio, l’hanno toccato cor un bastone per vedé se reagiva!…(Continua la lettura sul Vernacoliere in edicola, oppure  acquistalo scaricando la App gratuita del Vernacoliere dall’App Store per iOS, o da Google Play per Android).
