topic	title	subtitle	texts
	Con rispetto parlando		Chiacchierata tutta ammodino su alcune parolacce dell’idioma livornese. Che per parolacce non le tiene, ma per espressioni vivaddio sincere ed anche familiari d’un irriverente spiritaccio popolare poco incline agl’infingimenti quantunque letterari.E siccome si diceva  dell’infilarsi del dé in tutti i buchi, che poi a Livorno sono i bui, eccoci allora a parlar proprio del buo. Il quale, inteso quasi sempre come buco del culo, si unisce spesso ad altre parole (anche in fusione di grafia: buoderculo) in grande varietà d’usi e di significati, qui sotto riportati in un vasto elenco, non certo esaustivo ma di bui c’è comunque pieno.Buodiùlo (buo di ’ulo, budiùlo): epiteto largamente usato sia per indicare donna che si concede facilmente, sia per definire un uomo che si comporti in modo poco commendevole. Può anche avere una valenza solo apparentemente offensiva e invece affettuosamente familiare: Vieni, budiùlo! A casa tutti bene?Buolèvere (buo lèvere): di etimo incerto (forse da uno strumento d’uso portuale), può sia indicare sia una variante scherzosamente più leggera di buodiùlo, sia avere un più greve riferimento a  donna di trivio, come nell’uso pisano (col sinonimo buo d’orso, sempre sotto la Torre).Buolùngo/buosécco: persona alta e magra (O quer buosécco di Fassino, che fine ha fatto?).Buorótto: trattasi ovviamente di buco concernente l’uso sessuale, talché un buorotto non potrebbe mai essere una verginella (e neppure un verginello). Usatissimo a Livorno è ‘r buorotto di tu’ ma’! epico grido che nella variante ‘r budello di tu’ ma’! trova chiasmatica conferma in tu’ ma’ budello! Con buorotto  si indica anche persona di fortuna esagerata, detta pure buosfàtto, a guisa di colui che pur ricco come un creso riesce a non pagare quasi alcunché di tasse.Buosdegnóso  è la persona altezzosa che assume aria sdegnata, espressione di sufficienza o lo schifato atteggiamento di chi non si giova di qualcosa (un po’ talora come la Gelmini, a farle domande un poco acculturate).Buosfondàto: chi mangia smodatamente, come pure chi abusa della sua capacità anale in usi sessuali.Buo sfruonàto (sfronato): come buorotto, con evidenza però dello sfronare, frugare cioè in un pertugio con un bastone o corpo rigido similare ad uso stasatorio.Buostrìnto: persona tirchia; esse’ di buo strinto (esse’ stretto di buo): non distinguersi per generosità. Buistrinti proverbiali sono i lucchesi, mentre fra le lucchesi ce n’è anche di postura assai più rilassata.Largo di buo: persona generosa. Cosa?! ‘R ventipercento d’interesse?! Saòsa, se’ largo di buo! La donna larga di buo può essere generosa anche sessualmente, come qualche malalingua è arrivata a pensare persino di qualche formosa rappresentante di Forza Italia.Buostrappàto: epiteto anche spregioso ad indicare persona della quale ci si augura un buco ridotto proprio male, e con sofferenza.Buostecchìto: persona magra, segaligna, di aspetto cadaverico, o anche donna di scarsi fremiti sessuali, diaccia stecchita.Buonéro (buco nero): epiteto di cordiale familiarità, anche in formule di saluto: Vieni, buonero! A te buonero! Popò di buonero, dé!Buosùdicio: persona di scarsa pulizia, anche morale. L’epiteto tuttavia può anche avere toni familiarmente affettuosi, alla pari di buonero.Buolènte: persona facile al pianto; esse’ di buo lènte: commuoversi facilmente, o anche essere di vescica anche troppo attiva.Buovàdro: persona col culo quadrato, in senso di ironica o spregiativa irregolarità.A bùo a bùo: a buco a buco, appena in tempo, di stretta misura. Amelia, corri, ce l’ho ritto!… Dé, a buo a buo!A buoaggallìna (a buo a gallina, a buaggallina), a buorìtto, a buopunzóni: a buco ritto, col sedere per aria, col culo esposto, come la gallina che s’offre al gallo o come le mogli stanche quando propongono una veloce trombatina di schiena per non ammattire a girarsi nel letto. È anche la posizione atta a prenderlo nel culo metaforicamente: tutti a buoritto, via, c’è ‘na tassa nova!A buostòrto: a buco storto, di cattivo umore, controvoglia. Arzassi a buostòrto è la più comune delle situazioni umane fra quanti al mattino devono lasciare il letto per andare a lavorare.Avé’ buo: essere fortunato, incappare nell’occasione giusta, trovare le conoscenze adatte.Avé’ più bui ‘he cavicchi (lett.: avere più buchi in terra che cavicchi da ficcarci): avere più del necessario, avere molte amicizie, conoscenze, o anche avere più danni che rimedi ad essi.Esse’ tutto un buo (con quarcuno): essere in stretta confidenza con qualcuno, amarsi, avere gli stessi interessi: Berlusconi e Renzi? Tutto un buo!Forza, buo!: dai, coraggio! (in senso ironico), con le varianti forza buo, passa la banda! e forza buo, passa le cèe!
Senza peli sulla lingua	Il ponte i migranti e i coglioni		Lo confesso, all’indomani del crollo del ponte Morandi con quei 43 morti sfracellati mi venne immediato esclamare fra me e me sai che retata, ora! E li vedevo già tutti in galera, i responsabili. Che ci dovevano essere di certo, un ponte così non crolla perché c’è vento. E i segnali giù l’aveva dati, prima.
Class action Miliardi di danni chiesti ar capo della lega	SARVINI HA ROTTO ‘R CAZZO!	Milioni d'italiani Lo rivogliano novo!	Che Sarvini abbia rotto ‘r cazzo oramai lo dìano tutti, ‘un si sente ragionà d’artro! La gente s’incontra…E rompi ‘r cazzo oggi e rompi ‘r cazzo domani, alla fine è scoppiato ‘r bubbone!Dé, ‘un aveva ancora finito di dillo, tutti a urlà sissì, ce lo deve ripagà!Di modo e maniera son subito sartati su l’avvoati, che loro basta tu scivoli sur uno scaracchio per la terra e ti fanno fa’ causa di volata non sortanto allo scaracchiatore ma anche speciarmente ar Comune che ‘un ha messo le sputacchiere su’ marciapiedi!(…)
Basta Covid! L'Italia riparte! I ricchi rincominciano a arricchì	I POVERI METTANO ALL’ASTA ‘R CULO	Prima lo davano gratisse, ma ora Draghi n'ha dato fiducia in se stessi!	E alla fine Draghi s’è fatto sentì! Anzi a fassi sentì è stato Sarvini, a urlà qui o si riapre tutto o si more, e Draghi n’ha dato retta di volata! ‘Un sia mai che anche ‘r capo della nova ammucchiata di governo lo possino accusà di volé fa’ tutto lui come faceva Conte, ci mancherebbe artro!– Sì, a discorzi! Se va avanti di vesto passo, le sentirai fra poìno le manganellate!…
finarmente rotti l'indugi	APPELLO DI LETTA AI MANCINI	venite ner PD,  così ric'è un po' di sinistra	Povero Errico! Era lì che si batteva la testa ner muro e mugolava sconfortato ma ‘ndove la trovo io un po’ di sinistra ner Piddì, quando tuttantratto ‘r muro n’ha detto picchia piano, mi rompi i mattoni!Dé, l’olio nel lume! Sarà stato ‘r rintronìo delle botte ner cervello, sarà stata l’anzia d’inventà quarcosa di novo perdavvero, o vai ni s’è accesa la lampadina ‘n capo! (…)
Rassegna Film di Mac	IL TRIANGOLO COL TEGAME	ANDIAMO AL CINE	Drammatico ganzaiolo. Ambientato in una classica famiglia all’italiana (padre impiegato, madre casalinga e due figli studenti), il film ripropone tutta la drammatica inquietudine dei rapporti sociali tipica della cinematografia neorealista, col padre che un giorno porta un’avvenente collega in casa a pranzo e la vuol far restare a dormire con la scusa che poverina fuori piove a dirotto e fa anche tanto freddo; la madre che infine capisce perché il marito non la tromba più da mesi; e i due figli che tutti presi dall’iphone già non capiscono nulla dei triangoli a scuola e figuriamoci se gl’importa qualcosa d’un triangolo in famiglia.Ci penserà però la nonna (madre di lei, nonché suocera del fedifrago) a intervenire moralizzatrice, ringhiando all’intrusa “popò di buorotto rovinafamiglie, se ti prude vattela a fa’ grattà da’ marrocchini!”. E presala per il collo la butta giù per le scale, mentre gli altri condòmini allertati dalle grida s’affacciano alle ringhiere urlando “dagli anche du’ pedate nella pòtta, a quer tegame rifatto!”.Commovente il finale, sempre con la suocera che pur gridando al genero “era meglio se la mi’ figliola faceva la puttana ‘nvece di dalla a te, armeno ci guadagnava varcosa!” lo spinge a gollettoni fra le braccia della moglie a chiederle perdono, coi due figli che intanto continuano imperturbabili a smanettare sull’iphone, così simboleggiando l’indissolubilità della famiglia.
	Il dé dei miracoli		E s’incomincia intanto dal dé. Che parolaccia non è, ma siccome a Livorno il dé s’infila in tutti i buchi, ecco che s’attacca subito a parlare male.E a sgombrare di volata il campo da grafia e pronuncia largamente errate non solo extra moenia ma financo nella cinta livornese, va detto a botta che col dé esclamativo (da scriversi senza h e da pronunciarsi con la e chiusa come in perché – e forse derivato da mutazione vocalica del dì imperativo di dire – dì, bellino! si sente per esempio esclamare ancora da qualche anziana popolana, come a dire guà, mi ci manchereste propio te!) niente ci combina il dèh letterario (pronuncia aperta come in caffè) che introduce preghiere e desideri.Sentite per esempio questa invocazione d’un pio giovinotto pisano al Santuario di Montenero, prono davanti alla labronica Madonna:Infinite sono infatti le occasioni d’uso di questa tipica esclamazione (pressoché identificativa della livornesità, quantunque ora episodicamente usata anche a Pisa e in altre italiche lande contagiate dal Vernacoliere): come introduzione a un discorso (dé, ero lì che scurreggiavo, o ‘un mi son caàto addosso?!), come rafforzamento nel discorso (sicché n’ho detto stronzolo e lui dé, s’intendeva anche di brontolà!) o a sua conclusione (sicché n’ho ridetto stronzolo e l’ho picchiato benebene, dé!), in rafforzamento d’altra esclamazione (bòia, dé!) o d’un aggettivo (ganzo, dé!) o d’un sostantivo ((che tòpa, dé!), come commento genericamente asseverativo d’una qualche frase altrui (un’amica a un’altra: Certo, Berlusconi è propio un puttaniere! E l’altra: Dé!…) e in qualunque altra occasione in cui un livornese abbia da far capire d’esser per l’appunto livornese.
ancora uccisioni	USA		
	L’Oroscopo di Mario		ARIETE (21 marzo – 20 aprile) – È un momento parecchio sconcrusionato e deprimente, con dimorte palle mosce per l’òmini e tanta topa diaccia per le donne. Andrà un po’ meglio sortanto per quelli mezzi e mezzi,né òmini e né donne, che loro magari ‘r culo ce l’hanno sempre in tiro e quarche affare ni riesce rimediallo sempre.TORO (21 aprile – 21 maggio) – Probremi di pancia. Un po’ ‘r vostro sviscerato amore per le pentole di fagioli, un po’ tutto quer kèbabbe che v’è rimasto di traverzo, fattostà che ciavete l’intestino bello gonfio. Cercate pertanto di caminà a buostrinto evitando que’ tipici rumori che sarà ‘nutile cercà di coprì co’  soliti corpetti di tosse, perché tanto si capirà uguale che state per caàvvi addosso.GEMELLI (22 maggio – 21 giugno) – Durante una gita ‘n montagna conoscerete una graziosa  mucca che vi dirrà d’esse’ svizzera. ‘Un vi fidate! Oramai anche le mucche hanno ‘mparato a ’nventà le peggio ‘ose pur di fassi strizzà le puppe. Alle donne ‘nvece ni potrà capità di ‘onosce’ quarche toro, ma a lui le puppe ‘un niele strizzate, si potrebbe ‘mmaginà chissaccosa!CANCRO (22 giugno – 22 luglio) – A tutti i nati der Cancro le stelle ni ‘onzigliano di rinforzà i legami familiari. Legate perrtanto più forte vostra moglie per ‘un falla più corre’ a ritrombà cor ganzo, rinforzate decisamente i nodi a’ vostri figlioli per ‘un falli più andà a gioà d’azzardo e buassi, ficcate forte ‘r tappo ‘nculo alla vostra gatta che v’ha già riempito la ‘asa di micini, e stringetevi benebene la fune anche voi ar collo pe’ llevavvi finarmente di ‘ulo senzà più sbaglià.LEONE (23 luglio – 22 agosto) – Un lungo periodo di lontananza dalla famiglia v’ha fatto finarmente respirà un’aria differente. Ora però è l’ora di ritornà a casa, anche perché ‘r gabinetto l’hanno finarmente riparato e ‘un c’è più nessuno che càa per la terra.VERGINE (23 agosto – 22 settembre) – I vergognosi disservizzi ospidalieri, che la pubbria voce definisce “malasanità”, lasceranno ‘r segno anche su di voi. Entrerete difatti vergini all’ospidale, e ci sortirete che v’avranno rotto tutto. E quarchevvorta senza nemmeno addormentavvi prima, que’ troiai!BILANCIA (23 settembre – 22 ottobre) – Voi la dovete smette’ di penzà sempre alle malattie veneree! Vabbene che fra le gambe vi c’è venuta una colonia d’animaletti strani e ciavete la pelle tutta piena di zampine nere, ma questo pol’anche signifià che alle bestioline ni piacete per ir vostro tìpio tanfo di pelle tutta sudaticcia.SCORPIONE (23 ottobre – 22 novembre) – Grazie ar provvidenziale appoggio d’Urano e di Nettuno riuscirete a ‘un cascà per la terra quando scivolerete su ‘na merda  di ‘ane troppo sciorta. Ma ‘un ci contate sempre sull’appoggio de’ pianeti. Magari quest’artra vorta ‘r cane la farà più dura, e ‘nvece di scivolà c’intrampolerete andando di fittone.SAGITTARIO (23 novembre – 21 dicembre) – Un incessante transito astrale ner vostro cielo ‘un vi farà chiude’ occhio per tutta la nottata. E quando v’arzerete tutti ‘nzonnoliti per sortì di ‘asa, vi ritroverete nell’incessante traffio di camio e di macchine per la strada. E ner mentre doventerà ‘ncessante anche ‘r vostro giramento di ‘oglioni, conzolatevi cor penzà che tanto prima o poi devano andà tutti a morì ammazzati.CAPRICORNO (22 dicembre – 20 gennaio) – La collaborazione co’ ’na perzona ritenuta da voi dimorto fidata resurterà ‘na bella fregatura, speciarmente ner settore perdidietro, ‘ndove vi ritroverete cor un forte bruciaùlo, tìpio delle cràssie ‘nculate da fiducia senza vasellina.ACQUARIO (21 gennio – 18 febbraio) – Avrete finarmente l’occasione di scambià parecchie opinioni ‘nteressanti co’ ‘na persona che vi starà a sentì senza mette’ bocca, e ci ragionerete a lungo. E quando finarmente vi sarete sfogati, riordatevi che a ‘na cert’ora ‘r cimitero chiude, sennò ci rimanete dentro.PESCI (19 febbraio – 20 marzo) – È ‘r momento di piglià quarche iniziativa davvero originale. Se siete òmini provate presempio a favvi venì le mestruazioni, e se siete donne cercate di favvi arrizzà l’uccello. Magari ‘un ci riuscirete, ma armeno vi sarete resi la vita un po’ movimentata.
ULTIM'ORA	IL PRINCIPE STROZZATO		
Effetti collaterali - Sorpresa!	ASTRAZZENECA  FA SPARÌ  LE CORNA!	Un becco l'ha preso,  n'è ritornata la testa bella liscia!  ORA A PRENOTASSI C'È LA FILA!	Giorni addietro un becco è andato a vaccinassi, ‘un ha fatto a tempo a piglià la prima dose, le orna n’erano già doventate più piccine!Ma quando poi alla seonda dose le ‘orna ni sono sparite der tutto e n’è ritornata la testa bella liscia come prima di sposassi, lui è corso di volata a casa, ha aperto di rincorza l’uscio, s’è affacciato ‘n camera…– O te, a quest’ora?! – n’ha fatto sorpresa la su’ moglie, cor uno che ni stava sur groppone.– Dé, ma ‘un me la vedi la testa?! – n’ha giuggiolato lui. – Guarda vì, tò! Da oggi niente più corna!– Oggi ‘na sega! – ha stronfiato lei, ner mentre quell’artro la seguitava a zebà colla lingua ‘nfori. – Seddercaso da domani!
Effetti collaterali - Sorpresa!	ASTRAZZENECA  FA SPARÌ  LE CORNA!	Un becco l'ha preso,  n'è ritornata la testa bella liscia!  ORA A PRENOTASSI C'È LA FILA!	Giorni addietro un becco è andato a vaccinassi, ‘un ha fatto a tempo a piglià la prima dose, le orna n’erano già doventate più piccine!Ma quando poi alla seonda dose le ‘orna ni sono sparite der tutto e n’è ritornata la testa bella liscia come prima di sposassi, lui è corso di volata a casa, ha aperto di rincorza l’uscio, s’è affacciato ‘n camera…– O te, a quest’ora?! – n’ha fatto sorpresa la su’ moglie, cor uno che ni stava sur groppone.– Dé, ma ‘un me la vedi la testa?! – n’ha giuggiolato lui. – Guarda vì, tò! Da oggi niente più corna!– Oggi ‘na sega! – ha stronfiato lei, ner mentre quell’artro la seguitava a zebà colla lingua ‘nfori. – Seddercaso da domani!
Sportello COVID	OPERATRICE  DER SESSO CHIEDE:	Se 'r criente 'un cià  la mascherina  lo devo perforza piglià di poppa?	E vedrai ora, con questo macello della pandemia, faranno sciopero anche l’operatrici der sesso! No però per riaprì bottega, come tant’artre categorie! Loro ‘nvece la ‘iuderanno, stringendo per un po’ le ‘iappe, stufe come sono di dovello sempre piglià ‘nculo loro!Dice dé, ma è ‘r su’ mestiere! No, ‘r discorzo è un artro, e l’ha fatto papale papale una di lorolì allo Sportello Covid, che ora l’ha aperto ‘r Piddì per da’ fiato anche lì alle donne, da quando Letta ar posto di Zingaretti ha detto basta coll’òmini ‘n tutti ‘ bui, c’è anche tante donne che co’ bui ci sanno fa’ alla grande (…)
Sportello COVID	OPERATRICE  DER SESSO CHIEDE:	Se 'r criente 'un cià  la mascherina  lo devo perforza piglià di poppa?	E vedrai ora, con questo macello della pandemia, faranno sciopero anche l’operatrici der sesso! No però per riaprì bottega, come tant’artre categorie! Loro ‘nvece la ‘iuderanno, stringendo per un po’ le ‘iappe, stufe come sono di dovello sempre piglià ‘nculo loro!Dice dé, ma è ‘r su’ mestiere! No, ‘r discorzo è un artro, e l’ha fatto papale papale una di lorolì allo Sportello Covid, che ora l’ha aperto ‘r Piddì per da’ fiato anche lì alle donne, da quando Letta ar posto di Zingaretti ha detto basta coll’òmini ‘n tutti ‘ bui, c’è anche tante donne che co’ bui ci sanno fa’ alla grande (…)
Un novo Movimento  contro 'r mercato dell'Onorevoli  Basta colle portrone!	DIAMONI  LI SGABELLI!	Ma no sotto 'r culo! Ner groppone!	Lipperlì s’era penzato di stioccànnici le rotelline sotto le portrone, per fanni fa’ prima a cambià posto in Parlamento, da un partito all’artro. Ma poi c’era troppo tràffio e la Presidentessa Maria Elisabetta Arberti Casellati, Bettina per l’amici, ha detto basta mi ‘onfondete l’idee e scambiava fissa la destra colla sinistra anche perché oramai in Parlamento è tutto un guazzabuglio come ner governo Draghi e quando ni dici fascista a uno lui magari ti risponde risentito no guardi bene io sono der Piddì e se ‘nvece è d’Italiaviva ‘un si risente nemmeno, tanto coll’unità nazionale oggigiorno ‘un è più ‘r caso di fa’ finta d’esse’ schizzinosi, l’importante è restà bene ‘ncollati alle portrone e se ti devi spostà da un posto all’artro badalì (…)
Un novo Movimento  contro 'r mercato dell'Onorevoli  Basta colle portrone!	DIAMONI  LI SGABELLI!	Ma no sotto 'r culo! Ner groppone!	Lipperlì s’era penzato di stioccànnici le rotelline sotto le portrone, per fanni fa’ prima a cambià posto in Parlamento, da un partito all’artro. Ma poi c’era troppo tràffio e la Presidentessa Maria Elisabetta Arberti Casellati, Bettina per l’amici, ha detto basta mi ‘onfondete l’idee e scambiava fissa la destra colla sinistra anche perché oramai in Parlamento è tutto un guazzabuglio come ner governo Draghi e quando ni dici fascista a uno lui magari ti risponde risentito no guardi bene io sono der Piddì e se ‘nvece è d’Italiaviva ‘un si risente nemmeno, tanto coll’unità nazionale oggigiorno ‘un è più ‘r caso di fa’ finta d’esse’ schizzinosi, l’importante è restà bene ‘ncollati alle portrone e se ti devi spostà da un posto all’artro badalì (…)
L'editoriale	PANE E LAVORO	Senza peli sulla lingua	Dagli atrii muscosi, dai fori cadenti,/ dai boschi, dall’arse fucine stridenti,/ dai solchi bagnati di servo sudor,/un volgo disperso repente si desta,/intende l’orecchio, solleva la testa,/percosso da novo crescente romor.O non m’è rivenuto in mente quel coro dell’Adelchi a rivederlo oggi un volgo disperso – i disperati della pandemia, le turbe dei senza lavoro, i milioni di nuovi poveri abbandonati a se stessi – in ascolto d’un nuovo crescente rumor?Ma sì, eccolo il frastuono annunciatore di novella liberazione, eccolo il rumoreggiante avanzare d’impetuose correnti del PD, eccolo il travaglio profondo d’un partito annunciatore d’imminenti catartiche rivelazioni di destini nuovi al popolo stremato.E il popolo tende l’orecchio ed alza testa, libero infine dalla vile occorrenza dei bisogni immediati di pane e lavoro per attingere a speranze d’eventi di ben più nobile concetto, quel mitico futuro di giustizia e libertà che solo i destini di carriere e di poltrone dei maggiorenti in maieutica concorrenza possono infine riportare all’interesse vivo e vero di chi ancora lavora e fatica per poco pane e poca fica (…)
Annunci dell'Agenzia Mac	Compro baratto e vendo		* Nuovo negozio di biancheria intima vende mutande con buco omologato CEE per ragazze in cerca di lavoro anche in Europa.* Bimbo piccino pieno di merda in salotto cerca il modo d’avvisare il babbo al lavoro che la mamma non lo può pulire perché è impegnata in camera con un dimostratore di molle per il letto.* Moglie modello ’61 revisionata perdisotto, puppe gommate di recente, parrucca incorporata e chiappe di pelle con grinze originali scambierei con motocicletta anche forata purché ‘un rompa i coglioni come lei.* Du’ rotoli di cartagènia usati appena appena color nocciola con vivaci sfumature di colore cedo a persone amanti allegria cromatica anche al camerino.* Causa fuga di gasse m’è morta la socera all’improvviso e cerco espressioni di dolore guasi vero da adibire alla circostanza.* Volete mobili personali che vi durino un fottìo? Venite da noi, si fa le casse da morto su misura.* Cerco molla a scatto perdavvero per marito che ‘un ni s’arrizza più nemmeno i capelli.* Premiata ditta specializzata in contatti umani cerca ragazze disposte a fasi contattare. Chi resta ‘ncinta, noi ‘un si dice nulla.* Cercasi cane che sta pòo bene per veterinario alle prime armi. Se ve l’ammazzo vi rimborso.* Nuovo partito politico in rapida espansione cerca giovani volenterosi da avviare alla ricerca di tangenti. Si richiede auto propria e acqua in bocca.* Siete giovani ragazze disoccupate carine e volenterose che cercano lavoro a tutti i costi? Premunitevi con la nostra pomata contro le rinculate fisse.
a cura di don Mac	Il Vernacoliere mistico		
Annunci dell'Agenzia Mac	Compro baratto e vendo		
Dai Vangeli apocrifi	La parabola		
	Flatulenze	ai tempi del COVID	
DETTI LIVORNESI	A ME ME LO PUPPI!		A ME ME LO PUPPI! Nato come elaborazione del più semplice “puppa!” (l’irridente battuta che conclude domandine a tranello rivolte perlopiù ai pisani, del tipo: “Obluraski?”. “Eh?!”. “Puppa!”), il detto “a me me lo puppi!” è una tipica frase a invito del vernacolo livornese, un modo di dire in uso esclamativo che in risposta a qualcuno o a commento di qualche situazione testimonia o uno stato di acuta insofferenza (come può esser quella da palle piene, per esempio nell’ “a me me lo puppi!” con cui l’automobilista commenta l’ennesima contravvenzione per divieto di sosta, idealmente rivolto al vigile ed ancor più alla vigilessa responsabile del fatidico foglietto sul parabrezza) oppure una volontà d’intrattabile diniego (“a me me lo puppi!” esclama l’alunno al professore che lo implora d’impararsi a memoria magari un solo verso del Poeta) o financo un intento di derisione (tipico dell’ “a me me lo puppa!” rivolto dal genero alla suocera – dandole convenientemente del lei –  che gli chiede d’esser portata anch’essa nella domenicale gita familiare). E’ poi da segnalare appena, data l’ovvietà, che nell’invito al puppamento il dativo singolare “a me me…”, caratteristicamente rafforzato com’è d’uso nel linguaggio livornese, può tranquillamente mutare nel plurale “a noi ce…”. Mario Cardinali
Ai Ferrini corti	“Dichiarata zona rossa il culo degli italiani”		Dal nostro inviato Ettore Ferrini – Accade a Cecina, frazione di Cecina Mare. Un noto commerciante della zona, Gabriello Tondello, dopo aver aggiornato il registratore di cassa per la lotteria degli scontrini ha avvertito una violenta fitta allo sfintere. Recatosi in ambulatorio gli è stata riscontrata una grave forma di miseria endogena. A quel punto, affacciatosi sul balcone, si è prodotto in un comizio estemporaneo in cui sono fioccate alcune bestemmie inedite e la proclamazione ufficiale del culo come zona rossa, o almeno arancione rinforzato. In molti hanno aderito all’appello dando vita anche a una catena di solidarietà per l’acquisto di pomate specifiche da applicare sulla parte interessata.
