topic	title	subtitle	texts
Paura dell'inculata elettorale? Tranquilli! Questa vorta	IL CULO CE LO UNGE DI MAIO! Colla VASELLINA 5Stelle	il dito ner buo non sciupa la pelle!	Soffia un’aria nova nella polìtia, si sente dappertutto li spifferi d’onesà de’ Cinquestelle! Che tanto per principià, nell’avvicinassi der momento stòrio della su’ ascesa ar governo hanno detto basta colle solite rinculate a secco delle vecchie campagne elettorali, di quando i partiti ti stioccavano a buoritto senza nemmeno un po’ di sputo! Ve lo riordate? Ti rinculavano a secco gà prima dell’elezzioni, que’ troiai! Dice lo facevano per fattici fa’ subito l’abitudine, così poi ‘un potevi di’ oiòi m’avete rotto anche l’orecchi! Vabbene che come diceva Crassi, è meglio un culo rotto oggi che una potta spanata domani, ma tanto  poi a spanà anche le potte cià penzato Berlusconi, ‘un dubità! Che te per sapé come ce l’hanno fonda quelle di Forzitalia, ni metti un metro fra le gambe e s’un risorte fori vor dire che è sparito! Ma ecco finarmente  i Cinquestelle, a mette’ le ‘ose a posto! Tanto hanno studiato ‘na cea, per prepassi a andà ar governo! E studia te che studio io, hanno ‘apito che ‘r culo alla gente ni va trattato ammodo!…(Continua la lettura sul Vernacoliere in edicola, oppure acquistalo scaricando la App gratuita del Vernacoliere dall’App Store per iOS, o da Google Play per Android).
Per i veri bisogni proletari un novo Movimento di Sinistra!	POTTA AL POPOLO	per sortì finarmente dalle seghe!	Ciccio Beddaminchia (nome di chiara origine siciliana anche se lui è arrivato a Livorno da bimbetto perché su’ pa’ ci venne a fa’ ‘r pescatore di topedimare che n’avevano detto ritiravano su anche i pipi più mosci che la su’ moglie ‘un è stata mai d’accordo ma oramai Ciccio era gresciuto colla topa nella testa propio alla livornese e giù ‘un ce lo riportavi) e ‘nzomma quest’omo che ora è sulla settantina ma tu vedesse come seguita a scolassi i ponci anche se ‘un sono più quelli d’una vorta e da operaio s’è preso anche le manganellate della Celere ne’ cortei contro ‘r Misse, ‘nzomma propio lui quand’ha visto che giorni addietro a sinistra della sinistra di Grasso era venuta fori anche la Lista “Potere al popolo”, ha stronfiato potere una sega, ir popolo ha bisogno primaditutto di mangià , e per ora in Italia quarcosa ne ‘assonetti si trova sempre, eppoi ha bisogno speciarmente di tromba!…(Continua la lettura sul Vernacoliere in edicola, oppure  acquistalo scaricando la App gratuita del Vernacoliere dall’App Store per iOS, o da Google Play per Android).
La Lega vole riaprì i casini! Una lezione magistrale di Sarvini all'Università der Cazzo Quando c'era LUI funzionava tutto meglio!	IL DUCE FACEVA RIZZÀ ANCHE L’UCCELLI!	Bastava un alalà e tutti correvano a trombà!	L’incipit della lectio magistralis di Matteo Salvini all’Università del Cazzo è stato fulminante: – Il Duce, – ha rivelato a botta il capo della Lega – faceva rizzà anche l’uccelli! A dimostrazione che quando c’era LUI non arrivavano in orario soltanto i treni, ma si alzavano immediati anche i virili membri dell’italica razza! Bastava un alalà – ha spiegato Salvini – e l’italiani correvano a trombà! E correvano ovviamente nelle case chiuse, dette così per le persiane stoppinate ma il popolo le chiamava casini e i giovani vi si addestravano all’ars amatoria, ovverosia imparavano a trombà lì dentro come un tempo l’antichi romani nei lupanari, no come oggi che da quando i casini l’ha chiusi perdavvero la legge Merlin nel ’58,  le puttane oramai son dappertutto ma senza più regole igènie tipo la sciacquatura di potta e nemmeno di culo… (Continua la lettura sul Vernacoliere in edicola, oppure acquistalo scaricando la App gratuita del Vernacoliere dall’App Store per iOS, o da Google Play per Android).
L'editoriale - Senza peli sulla lingua	L’ODIO PREVENTIVO		Salvini è un razzista, non ci piove sopra. E non fa niente per nasconderlo. Come non piove sul suo essere fascista. Ma lì il capo della Lega (emblema di fasciorazzismo tout court, a riunire in un termine solo l’antica e la presente qualità del grande magma in perenne ribollimento nelle italiche vene) fa le finte, si schermisce, disapprova ma giustifica, approva e minimizza, riduce i nuovi squadrismi a ragazzate, qualifica folclore le militaresche sfilate neonaziste di Casa Pound e Forza Nuova… (Leggi tutto il pezzo sul Vernacoliere in edicola, oppure scaricando la App gratuita del Vernacoliere dall’App Store per iOS, o da Google Play per Android).
L'editoriale - Senza peli sulla lingua	LA GRANDE POMPA		Tempo di banche. Che ci son sempre state, ma ora se ne fa un parlare assai più fitto, con certe fregature che ormai scoppian come bolle, ce n’è l’aria piena. In attesa che tutto torni come prima. Un tempo ci si chiedeva chi ci avrebbe prestato i quattrini se la banca avesse chiuso. Quei quattrini comunemente definiti “a strozzo”, con tassi cosiddetti legali che definire usurari a volte era un parlar garbato…(Leggi tutto il pezzo sul Vernacoliere in edicola, oppure scaricando la App gratuita del Vernacoliere dall’App Store per iOS, o da Google Play per Android).
Pedofilia che sbaglia	PRETE INCHIAPPETTA UN NANO	scambiato per un bimbo! Corteo di nani a protestà dar papa!	(Leggi il pezzo sul Vernacoliere in edicola, oppure scaricando la App gratuita del Vernacoliere dall’App Store per iOS, o da Google Play per Android).
Crisi delle nascite	DONNA PARTORISCE DODICI STRONZOLI	"e spiega: ""Ir mi' marito è un gran pezzo di merda!"""	(Leggi il pezzo sul Vernacoliere in edicola, oppure scaricando la App gratuita del Vernacoliere dall’App Store per iOS, o da Google Play per Android).
Ir mastice ha ceduto!	S’È SCOLLATO BERLUSCONI!	'Un tiene più nemmeno collo sputo!	(Leggi il pezzo sul Vernacoliere in edicola, oppure scaricando la App gratuita del Vernacoliere dall’App Store per iOS, o da Google Play per Android).
	La presentazione di dicembre		In una veloce sintesi il direttore del Vernacoliere, Mario Cardinali, presenta il suo editoriale e i suoi pezzi satirici sul Vernacoliere di dicembre 2017. Il Vernacoliere è in vendita nelle edicole di tutta la Toscana e in parte di quelle dell’Umbria, del Lazio, della Lombardia, del Piemonte e del Veneto, oppure disponibile scaricando la App gratuita del Vernacoliere su App Store e su Google Play.
Molestie sessuali	SI SOGNA ‘R CULO DELLA BOSCHI	e Renzi lo butta fori dar Piddì!	I giornali si sa come sono, ingigantiscano tutto! Che lipperlì ‘r Tirreno aveva sparato «Tocca ‘r culo alla Boschi e vede la Madonna!» e ner pezzo c’era anche scritto «La pia donna n’ha detto trogolone ma lui è contento lostesso perché era tanto che ‘un la vedeva!» Ma ‘un era mìa vero nulla! Né der culo e né della Madonna, ner senso che quer tizzio ‘r culo della Boschi se l’era sortanto sognato, e trogolone e quarcos’artro niel’ha detto Renzi, appena l’ha saputo! – Fori dar Piddì! – n’ha urlato coll’occhi perdifori, come l’ha visto co’ pantaloni sempre gonfi sur davanti…(Continua la lettura sul Vernacoliere in edicola, oppure acquistalo scaricando la App gratuita del Vernacoliere dall’App Store per iOS, o da Google Play per Android).
La crisi del PD Non c’è più rispetto per il Capo!	RENZI TRACCIA IL SOLCO E L’ARTRI NI CI CÀANO!		Partito Democratico in caduta sempre più rovinosa, con la sua gran parte di destra che s’è ormai buttata verso la destra ufficiale, giudicando l’originale migliore della copia. E la parte piccola di sinistra che s’è messa per conto suo. Restano a Renzi gli ancora tanti leccatori di culo, ma già si nota che ora, appena gliel’hanno leccato, si puliscono la bocca o magari fanno i gargarismi, a far ben capire che anche loro non gradiscono più come prima. Ma il segno più inequivocabile della crisi è stato quando Renzi – nella sua tipica postura di ducetto di Rignano – s’è messo all’aratro su un campo, memore del detto mussoliniano “è l’aratro che traccia il solco ma è la spada che lo difende”. O vai che la spada non l’aveva sottomano, e nel girarsi a cercarla s’è accorto che sulla parte di solco già tracciato gli ciavevano caàto!(Continua la lettura sul Vernacoliere in edicola, oppure  acquistalo scaricando la App gratuita del Vernacoliere dall’App Store per iOS, o da Google Play per Android).
Artro che la Panini! Il Vernacoliere presenta	LE FIGURINE DI MERDA DELLA NAZIONALE!	Quelle di Ventura e Tavecchio le più grosse!	di Mario Cardinali, Andrea Camerini e Valter Cardinali Poteva il Vernacoliere restare insensibile al grido di dolore dell’Italia tutta per l’esclusione della nostra Nazionale dai Mondiali di pallone? No che non poteva! Ed eccoci allora a consolare gli animi afflitti e querimoniosi col celebrativo lancio di nuovissime figurine di calciatori, molto più adatte e aggiornate – nell’occasione del disastro – delle tradizionali figurine Panini. Segue una tavola di figurine comico-satiriche di calciatori e dirigenti della Nazionale, disegnate e commentate da Andrea Camerini e Valter Cardinali.(Continua la lettura sul Vernacoliere in edicola, oppure acquistalo scaricando la App gratuita del Vernacoliere dall’App Store per iOS, o da Google Play per Android).
L'editoriale - Senza peli sulla lingua	LE POVERE FIGLIE DEI SANTI		Sono le piccole cose, a volte, che danno spunto di riflessione su cose assai più grandi. Guarda per esempio – è roba d’attualità locale livornese ma s’allarga a tutto un discorso generale – il caso di quel panoramicissimo albergo di Montenero gestito in grande attivo da una cooperativa con otto dipendenti ma chiuso dalle suore proprietarie, che in quella splendida villa del ‘700 pare vogliano aprire una ben più redditizia esclusiva residenza per anziani. Quelle suore, guarda un po’, si chiamano Figlie povere di S. Giuseppe Calasanzio, e verrebbe da dire figuriamoci se fossero state ricche. Ma si sa, la conclamata povertà dei nomi è storico usbergo di tanti Ordini religiosi possessori invece di tant’altre ricchezze soprattutto immobiliari, nelle quali si frastaglia gran parte dell’immenso patrimonio vaticano. Talché è gran voce il frequente dire – da parte d’alcuni – ma te vedi a cosa serve poi la religione… (Leggi tutto il pezzo sul Vernacoliere in edicola, oppure scaricando la App gratuita del Vernacoliere dall’App Store per iOS, o da Google Play per Android).
	La presentazione di novembre		In una veloce sintesi il direttore del Vernacoliere, Mario Cardinali, presenta il suo editoriale e i suoi pezzi satirici sul Vernacoliere di novembre 2017. Il Vernacoliere è in vendita nelle edicole di tutta la Toscana e in parte di quelle dell’Umbria, del Lazio, della Lombardia, del Piemonte e del Veneto, oppure disponibile scaricando la App gratuita del Vernacoliere su App Store e su Google Play.
Ora un Referèndu si fa noi!	VOLETE MANDÀ I POLITICI ’NCULO A RATE O TUTT’ASSIEME?	Fra tutti i votanti sarà estratto un paio di palle nove  ar posto di quelle rotte!	A giro ‘un si sente di’ artro: devano andà tutti ‘nculo… devano andà tutti ‘nculo… Te vai a fa’ la spesa, trovi i soliti rincari e c’è pòo da fa’, li mandi tutti ‘nculo! E così ar barre: anche se quer giorno roba rincarata ‘un ce n’è, c’è sempre varcuno che urla devano andà tutti ‘nculo! Come anche alla mutua, all’ospidale… lo senti di’ perfino ar cimitero, quando a’ parenti der morto ni fanno vedé ‘r conto! E ‘nzomma, botta botta fiosecco! ‘Ndove vai vai, per la gente i politici sempre ‘nculo devano andà! Ma c’è anche chi cià da ridire. No sur mandalli ‘nculo, ma come ce li mandi! Tutti assieme no, dice presempio un ber po’ di gente, poi sennò ‘r culo s’intasa! Meglio sarebbe un po’ alla vorta, di modo e maniera che anche ‘r culo poverino pole respirà…(Continua la lettura sul Vernacoliere in edicola, oppure acquistalo scaricando la App gratuita del Vernacoliere dall’App Store per iOS, o da Google Play per Android).
Un’artra grave crisi nella Sinistra! MDP dichiara:	A PISAPIA NI PUZZA LA FIA!	Ora sì che ‘un ci si ‘apisce più nulla!	Signore com’è, Pisapia ‘un ha fatto ‘na piega. «A me me l’annusate…» ha uozzappato spregioso a quelli der Movimento Demogràtio e Progressista, appena letto la su’ dichiarazione. Che loro dé, a boccaperta! «Annusalla a Pisapia?!» tutti a stronfià, e Bersani lipperlì ‘un capiva che loro avevano capito un’artra ‘osa e no la fia! E ‘nzomma pareva uno spregio fatto perapposta, la risposta di Pisapia, a chiude’ davvero un artro tentativo di rimette’ d’accordo più di vattro persone alla vorta dentro la sinistra!(Continua la lettura sul Vernacoliere in edicola, oppure  acquistalo scaricando la App gratuita del Vernacoliere dall’App Store per iOS, o da Google Play per Android).
L’immigrati seguitano a affogà! Medici Senza Frontiere accusa:	LA LEGA MANDA I SARVAGENTI MAPPERÒ BUATI!		di Mario Cardinali ’Un c’è nulla da fa’, l’immigrati seguitano a affogà! E sì Minniti ce l’ha messa tutta, a dinni di restà ‘n Libia! E i libici ce la mettano anche loro tutta, a convincelli a restà! Li rinchiudano ne’ laghe’ ma loro macché, cercano di scappà! Li torturano benebene e loro nulla, magari ci schiantano ma ‘un vogliano sta’ fermi! E anche vando i libici ni trombano le donne sotto l’occhi e ni violentano i figlioli sotto ‘r naso, loro guardano da ‘n’artra parte e alla fine cercano di ‘onvince’ le su’ famiglie rimaste nelle ‘apanne de’ su’ paesi a mandà dell’artri vaìni come nieli chiedano i libici per falli scappà e li scafisti per falli ‘mbarcà, e ‘na vorta ‘mbarcati ce n’è sempre un fottìo che seguitano a affogà! Dice dé, ni si potrebbe ‘mparà a notà!…(Continua la lettura sul Vernacoliere in edicola, oppure acquistalo scaricando la App gratuita del Vernacoliere dall’App Store per iOS, o da Google Play per Android).
L'editoriale - Senza peli sulla lingua	MERCATO GENERALE		Non era dunque mafia quella di Mafia Capitale. Solo corruzione, han motivato i giudici precisi. Che magari avranno anche respirato sollevati. E figuriamoci, un po’ di corruzione in più nel paese più corrotto d’Europa… Che poi non è nemmeno corruzione in più. Pare in più quando viene a galla, ma c’è sempre stata. E sempre ci sarà, dicono quelli che il popolo lo tengono informato. E non solo per la serie ”te dai una cosa a me, io ne dò una a te”, ma anche per il noto principio “se vuoi un tuo diritto, pagami il servizio” o anche “dove girano i quattrini c’è da far quattrini”. E questo solo per i livelli bassi. Per quelli alti c’è anche assai di più, nel chiedere e nell’offrire… (Leggi tutto il pezzo sul Vernacoliere in edicola, oppure scaricando la App gratuita del Vernacoliere dall’App Store per iOS, o da Google Play per Android).
	Vi aspettiamo a Lucca Comics!		Il direttore e gli autori de “Il Vernacoliere” vi aspettano anche quest’anno a Lucca Comics in piazza Napoleone, dall’1 al 5 Novembre.Presenteremo tre nuove pubblicazioni: Inps-Men di Max Greggio e Andrea Rovati, Il Toio 8 di Andrea Camerini, Cinemaialate Di Ettore Ferrini e Claudio Marmugi e un clamoroso DVD, Troio di Spade, un esilarante cartone animato di Andrea Camerini.
A Certaldo	Il Premio Boccaccesca a Mario Cardinali		Un altro significativo riconoscimento per Mario Cardinali, direttore-editore del Vernacoliere, che dopo la “Canaviglia” del Comune di Livorno nel 2015 e il “Nastro d’Argento” della Regione Toscana nel 2016, ha ricevuto l’8 ottobre a Certaldo il ”Premio Boccaccesca”, destinato a quanti abbiano onorato in Italia e nel mondo la toscanità. Nel caso di Cardinali, più che una toscanità una livornesità libertaria e dissacratrice, espressa in una satira ferocemente e popolarmente sui generis con la quale  il Vernacoliere sputtana padroni e palazzi da trentacinque anni. La premiazione si è svolta nello storico Palazzo Pretorio di Certaldo per mano del sindaco della stupenda cittadina medievale, patria di Giovanni Boccaccio, davanti a un gran pubblico interessato e divertito per quasi un’ora da Cardinali con una chiacchierata storico-giornalistico-satirica che menomale poi l’inarrestabile oratore si è chetato, sennò ci facevano buio. Nella foto, da sinistra: il sindaco di Certaldo Giacomo Cucini, l’assessore alla cultura e turismo  Francesca Pinochi, Mario Cardinali e la direttrice artistica della manifestazione Claudia Palmieri.https://www.google.it/url?sa=t&rct=j&q=&esrc=s&source=web&cd=2&ved=0ahUKEwjnjdLyi-TWAhXBPBQKHV3NAEAQtwIILDAB&url=https%3A%2F%2Fwww.youtube.com%2Fwatch%3Fv%3DGNH0CEATQ7A&usg=AOvVaw3SSAfv_mDJAwT3OpLD2nWf
	Le Novità del Vernacoliere		Di Ettore Ferrini e Claudio Marmugi con illustrazioni di Tommy Eppesteingher. Volume di 128 pagine. Irriverente e sarcastico bestiario satirico sulla settima arte, che in ironia ora grevemente feroce ora raffinata presenta un cinema come non l’avete mai… riso, rifacendo vivere titoli famosi in irresistibile parodia critica. Eccezionalmente prefato da Alessandro Benvenuti. € 12,00Di Andrea Camerini. Fumetto di 64 pagine. Arricchita di pagine inedite, ecco l’ottava raccolta delle strabilianti avventure del Troio, famoso personaggio del Vernacoliere, alle prese col su’ babbo Enio e con un mondo di topa. € 10,00Testi Max Greggio, disegni Andrea Rovati Fumetto di 32 pagine. Ad arricchire la grande tradizione comico-satirica dei Supereroi creati da Max Greggio sul Vernacoliere a partire dal mitico Budiùlik negli anno ‘70, ecco ora gli straordinari INPS-MEN, squinternato gruppo di pensionati mutanti e disincantati che combattono per la sopravvivenza, propria e dei loro simili, contro la malefica Fornerius. Con le eccezionali illustrazioni di Andrea Rovati. € 8,00
Usa-Corea – Sempre più vicina la GUERRA NUCLEARE	DIO ’NCAZZATO COLL’UMANITÀ	Ciò messo sei giorni a fa’ ‘r mondo e me lo volete sfa’ in mezz’ora! MA PRIMA VI FURMINO TUTTI!	«Òmini di merda!». Comincia propio ‘osì, coll’òmini di merda, ir comuniato urgente che appena l’Ufficio Stampa Celeste l’ha messo su Fèisbuc, dopo du’ menuti ciaveva digià du’ milioni di ‘ontatti di gente a boccaperta! E no tanto per la merda, che a dire ‘r vero noi òmini un po’ stronzoli siamo, quanto per ir seguito, ‘ndove ‘r comuniato dice «IO ciò messo sei giorni a fa’ ‘r mondo, e voi me lo volete sfa’ in mezz’ora! Ma prima vi furmino tutti!» Dé, IO a lettere grandi, ‘un  poteva esse’ artro che LUI! Che ‘ncazzato a quer modo, doveva esse’ successo varcosa di grosso perdavvero!…(Continua la lettura sul Vernacoliere in edicola, oppure acquistalo scaricando la App gratuita del Vernacoliere dall’App Store per iOS, o da Google Play per Android).
Dopo l’alluvione - A Livorno cambia tutto! Ar posto della Protezione Civile	LA PROTEZIONE VESCOVILE!	In caso di perìolo sarà ‘r Vescovo ‘n persona a sonà le ‘ampane!	Dopo l’alluvione –  A Livorno cambia tutto! Ar posto della Protezione Civile LA PROTEZIONE VESCOVILE! In caso di perìolo sarà ‘r Vescovo ‘n persona a sonà le ‘ampane!di Mario Cardinali Cià la cràssia ghigna a pisano ma è furbino uguale, ‘un dubità! Appena è successo tutto vér popò di macello dell’alluvione, ha detto subito qui la ‘orpa ‘un è tutta dell’acqua! Dé, pol’esse’ anche der vino, ha penzato lipperlì quarcuno fra i fedeli stipati ‘n Domo a sentì l’omelia per quella povera famiglia affogata ner fango, ma ‘r vescovo ‘ntendeva ‘r sindao e tutta la protezione civile ‘omunale che quella notte der finimondo era stata presa alla sprovvista perché nessuno n’aveva detto nulla, loro tutto quer cielo che veniva giù lo sentivano ma dice l’alluvione la Regione l’aveva data per l’indomani, ‘nzomma ‘un s’erano ‘apiti…(Continua la lettura sul Vernacoliere in edicola, oppure  acquistalo scaricando la App gratuita del Vernacoliere dall’App Store per iOS, o da Google Play per Android).
Economia - Bone notizie	LA CORRUZIONE SI QUOTA IN BORSA	A ruba le prima azioni! Per quell’artre ci vole la tangente!	
L'editoriale - Senza peli sulla lingua	MA TE VALLO A IMMAGINARE		di Mario Cardinali Diciamocelo in ghigna, quei morti li abbiamo sulla coscienza un po’ tutti. Comincia così sul Vernacoliere di ottobre l’editoriale del direttore, in cui Cardinali spiega chi sono a suo avviso quei tutti – dagli amministratori d’oggi a quelli di ieri fino ai livornesi complessivamente – e per quali motivi hanno in qualche modo sulla coscienza i nove morti causati dalla tremenda alluvione scatenatasi su Livorno nella notte fra il 9 e il 10 settembre.(Leggi tutto il pezzo sul Vernacoliere in edicola, oppure scaricando la App gratuita del Vernacoliere dall’App Store per iOS, o da Google Play per Android).
	La presentazione di ottobre		In una veloce sintesi il direttore del Vernacoliere, Mario Cardinali, presenta il suo editoriale e i suoi pezzi satirici sul Vernacoliere di ottobre 2017. Il Vernacoliere è in vendita nelle edicole di tutta la Toscana e in parte di quelle dell’Umbria, del Lazio, della Lombardia, del Piemonte e del Veneto, oppure disponibile scaricando la App gratuita del Vernacoliere su App Store e su Google Play.
	La presentazione di agosto/settembre		In una veloce sintesi il direttore del Vernacoliere, Mario Cardinali, presenta il suo editoriale e i suoi pezzi satirici sul Vernacoliere di agosto/settembre 2017. Il Vernacoliere è in vendita nelle edicole di tutta la Toscana e in parte di quelle dell’Umbria, del Lazio, della Lombardia, del Piemonte e del Veneto, oppure disponibile scaricando la App gratuita del Vernacoliere su App Store e su Google Play.
Sagre & Fiere  - Novità|	GRANDE FESTA DEI BECCHI	Presenta MATTEO SARVINI	E ora Matteo Sarvini invitato addirittura alla Grande Festa dei Becchi! Che a dire il vero i becchi le su’ Feste l’hanno sempre fatte, ma Sarvini ‘un ciaveva mai partecipato! L’invito al clamoroso evento, che si svolgerà a Cornate sul Naviglio, è partito direttamente dal presidente dell’UIBC. – Pronto, Sarvini? Ho il piacere d’invitarla ufficialmente alla Festa Nazionale dell’Unione Italiana Becchi Contenti! – Ma io ‘un sono contento! – Ma becco sì! – Ah, dice pervìa dell’Isoardi? – Dé, bene lei! Con quer popò di ciuccione a quell’artro Matteo…(Continua la lettura sul Vernacoliere in edicola, oppure acquistalo scaricando la App gratuita del Vernacoliere dall’App Store per iOS, o da Google Play per Android).
Solidarietà	AIUTIAMO RENZI A CASA SUA!	Così poi ‘un ci rompe più i coglioni a casa nostra!	di Mario Cardinali Povero Renzi, ora che è rimasto tutto bava e basta, ni danno addosso tutti! Una lecciata dopo l’artra, ‘un ripiglia fiato! No, mìa per nulla, ma ‘un aveva fatto a tempo a  cercà di riavessi dopo la batosta der referendu costituzzionale cor su’ governo a carte varantotto, ecco lo scandalo Cònsippe di volata ner groppone, con su’ pa’ e ‘r su’ fido ministro Lotti accusati d’avé fatto pappa e ciccia anche loro con tutto quer popò di mangiamangia! E ner mentre Renzi faceva le mosse di sdegnassi cor dire schifato è tutta merda di gentaccia e chiaccherava e sbavava e ‘un si ‘etava mai, ecco Bersani con quell’artri der Movimento demogratio e progressista che ni sono andati ‘n culo, ecco D’Alema …(Continua la lettura sul Vernacoliere in edicola, oppure  acquistalo scaricando la App gratuita del Vernacoliere dall’App Store per iOS, o da Google Play per Android).
Berlusconi animalista	SIRVIO RITORNA COLLE TROIE!	Ma no le troie escort, le troie maiale!	di Mario Cardinali Pareva ‘un ni si rizzasse più nemmeno la pompetta, e ‘nvece riecco Berlusconi alla grande colle troie! E tutti a dire vai, capace ora ne riporta quarcuna ‘n parlamento e magari perfino ner governo! E ‘nvece questa vorta le troie di Sirvio ‘un sono l’èscorte di sempre, le solite orgettine che lui ci faceva a Arcore ‘r trenino colla fava dice di du’ metri ma piuccheartro era di du’  metri ‘r rotolo di bigliettoni che lui nielo pigiava ar culo eppoi ni ce lo lasciava dentro per riordo, e più loro se lo volevano riordà e più lui lo faceva doventà più grosso, ‘r rotolone….(Continua la lettura sul Vernacoliere in edicola, oppure acquistalo scaricando la App gratuita del Vernacoliere dall’App Store per iOS, o da Google Play per Android).
L'editoriale - Senza peli sulla lingua	FASCIORAZZISTI D’ITALIA. E D’EUROPA		di Mario Cardinali “Dum Romae consulitur, Saguntum expugnatur”. Ve lo ricordate il vecchio Tito Livio? “Mentre a Roma si chiacchiera, Sagunto viene espugnata”. E mentre stiamo qui a sbracciarci sul teatrino dell’antifascismo di maniera, il fascismo di sostanza avanza dovunque e dovunque fa macerie. Macerie soprattutto d’un’idea di libertà che non è certo quella del garantismo per tutti i pensieri comunque manifestati e propagandati – quelli propugnanti dittature e razzismo compresi – come ora c’è venuto a dire anche Grillo, a conforto di tanta sua base fascistoide, accusando di liberticidio la legge proposta dal piddino Fiano contro la dilagante e indisturbatamente esibita propaganda fascista e nazista….(Continua la lettura sul Vernacoliere in edicola, oppure  acquistalo scaricando la App gratuita del Vernacoliere dall’App Store per iOS, o da Google Play per Android).
