topic	title	subtitle	texts
Finarmente!  ’R PAPA:	I PRETI  SI POTRANNO SPOSÀ!  I PRETI:  SI TROMBA!	LE SORE:  E NOI NEMMENO UN FIDANZATO!	di Mario Cardinali Dé,’r Papa un aveva ancora finito di dire che ‘r celibato de’ preti oramai ce n’ha per pòo e anche loro prima o poi si potranno sposà, e già i primi cortei di preti erano per la strada a festeggià come per l’Italia campione der mondo!   E chi urlava si tromba si tromba, chi sventolava la bandiera colla topa disegnata sopra, chi s’abbracciavano fra loro e si toccavano ‘r culo l’un coll’artro ma oramai più per abitudine che per ir solito ‘nteresse, chi urlava basta seghe, e ‘nzomma era tutto un ribollì d’entusiasmi e di speranze, tutto un tripudio di tònae che ni si vedeva l’uccello ritto sotto, dall’eccitazzione der momento!   E mìa sortanto i preti, a fa’ festa! C’era anche un fottìo di bimbetti tutti ‘ontenti anche loro della topa a’ preti a urlà ‘n corteo così vedrai la smettano di mettecci le mani sempre addosso a noi anche se ci frizza troppo ‘r culino, e assieme a’ bimbi c’era anche tanti genitori a sperà d’un vedesseli più ritornà a casa dar cateìsmo tutti ‘ndolenziti que’ figlioli, che uno li manda ‘n chiesa a sta’ ‘n ginocchio per pregà e no per pigliallo ner diociscampieliberi, ma guarda te se uno se la deve rifà co’ ragazzi ‘nvece ‘he colle donne, e sì che seddercaso cianno le sore a portata di mano!   Ma dé, povere sore! La gente se ne riorda sortanto quando c’è da mandalle affanculo pervìa che cianno sempre certe ghigne, anche loro… ‘Un ci penza mìa, la gente, che sì, hanno fatto voto di castità quelle sorine, ma sotto ‘r velo cianno ‘r sangue che ni ribolle anc’a loro, donne ‘ome sono uguali all’artre! (… ) Continua la lettura sul Vernacoliere in edicola oppure abbonati su shop.vernacoliere.comDé,’r Papa un aveva ancora finito di dire che ‘r celibato de’ preti oramai ce n’ha per pòo e anche loro prima o poi si potranno sposà, e già i primi cortei di preti erano per la strada a festeggià come per l’Italia campione der mondo!E chi urlava si tromba si tromba, chi sventolava la bandiera colla topa disegnata sopra, chi s’abbracciavano fra loro e si toccavano ‘r culo l’un coll’artro ma oramai più per abitudine che per ir solito ‘nteresse, chi urlava basta seghe, e ‘nzomma era tutto un ribollì d’entusiasmi e di speranze, tutto un tripudio di tònae che ni si vedeva l’uccello ritto sotto, dall’eccitazzione der momento!E mìa sortanto i preti, a fa’ festa! C’era anche un fottìo di bimbetti tutti ‘ontenti anche loro della topa a’ preti a urlà ‘n corteo così vedrai la smettano di mettecci le mani sempre addosso a noi anche se ci frizza troppo ‘r culino, e assieme a’ bimbi c’era anche tanti genitori a sperà d’un vedesseli più ritornà a casa dar cateìsmo tutti ‘ndolenziti que’ figlioli, che uno li manda ‘n chiesa a sta’ ‘n ginocchio per pregà e no per pigliallo ner diociscampieliberi, ma guarda te se uno se la deve rifà co’ ragazzi ‘nvece ‘he colle donne, e sì che seddercaso cianno le sore a portata di mano!Ma dé, povere sore! La gente se ne riorda sortanto quando c’è da mandalle affanculo pervìa che cianno sempre certe ghigne, anche loro… ‘Un ci penza mìa, la gente, che sì, hanno fatto voto di castità quelle sorine, ma sotto ‘r velo cianno ‘r sangue che ni ribolle anc’a loro, donne ‘ome sono uguali all’artre! (… )
MIGRANTI	PREMIO A CHI RESTA  A MORÌ A CASA SUA!	La Meloni offre la cassa  e Sarvini ci mette ‘r karaoke!	di Mario Cardinali Povera Meloni, era sempre lì tutta piena di brividi per que’ poveracci affogati a Cutro che vabbene s’un partivano ‘un affogavano come dice Fertri che ni piace tanto ‘r vino ma ‘nzomma parecchia pena la facevano lostesso, tantevvero lei ‘un c’è nemmeno voluta andà a vedelli tutti que’ morti reuperati dar mare speciarmente  que’ poveri bimbini affogati a mucchi, rinchiusi in quelle bare bianche con Mattarella che ‘nvece c’è andato a testabassa come capo dello Stato, bello Stato sì che prima ti fa affogà eppoi ti viene a piange’ davanti come ‘ ‘occodrilli ma ‘nzomma lui c’è andato a vergognassi anche s‘un sapeva nulla di tutto ver macello prima ‘he succedesse ma quell’artri lo sapevano a cosa andava ‘ncontro quell’imbarcazzione ner mare grosso da fa’ spavento anche alle motovedette della Polizia andate a vedé se c’era da arrestà quarcuno e sono ritornate di volata addietro ner mentre la Guardia costiera che quer mare ni faceva un baffo ‘un s’è mossa chissà perché ma ‘r Governo zitto e buci e sicché poi la Meloni ha detto oggiù vado alla festa per i cinquant’anni di Sarvini e così mi distraggo un po’ e magari c’è anche ‘r karaoke che difatti lei l’ha fatto in un duetto propio con Sarvini e tutti i critioni a dire ma te guardalì se si por sentire tutte vélle stecche sannonasega loro di cantare ma la Meloni ha detto oggiù via, ora mi son ripresa è l’ora di fa’ quarcosa perdavvero per que’ poveracci ora ci penzo (…) Continua la lettura sul Vernacoliere in edicola oppure abbonati su shop.vernacoliere.comPovera Meloni, era sempre lì tutta piena di brividi per que’ poveracci affogati a Cutro che vabbene s’un partivano ‘un affogavano come dice Fertri che ni piace tanto ‘r vino ma ‘nzomma parecchia pena la facevano lostesso, tantevvero lei ‘un c’è nemmeno voluta andà a vedelli tutti que’ morti reuperati dar mare speciarmente  que’ poveri bimbini affogati a mucchi, rinchiusi in quelle bare bianche con Mattarella che ‘nvece c’è andato a testabassa come capo dello Stato, bello Stato sì che prima ti fa affogà eppoi ti viene a piange’ davanti come ‘ ‘occodrilli ma ‘nzomma lui c’è andato a vergognassi anche s‘un sapeva nulla di tutto ver macello prima ‘he succedesse ma quell’artri lo sapevano a cosa andava ‘ncontro quell’imbarcazzione ner mare grosso da fa’ spavento anche alle motovedette della Polizia andate a vedé se c’era da arrestà quarcuno e sono ritornate di volata addietro ner mentre la Guardia costiera che quer mare ni faceva un baffo ‘un s’è mossa chissà perché ma ‘r Governo zitto e buci e sicché poi la Meloni ha detto oggiù vado alla festa per i cinquant’anni di Sarvini e così mi distraggo un po’ e magari c’è anche ‘r karaoke che difatti lei l’ha fatto in un duetto propio con Sarvini e tutti i critioni a dire ma te guardalì se si por sentire tutte vélle stecche sannonasega loro di cantare ma la Meloni ha detto oggiù via, ora mi son ripresa è l’ora di fa’ quarcosa perdavvero per que’ poveracci ora ci penzo (…)
Riforma fiscale  Pagano meno i ricchi	LO PIGLIANO DIPIÙ  ’NCULO I POVERI	E le povere anche  nell’artri bui!	di Mario Cardinali Ma anche prima de’ sindaàti si son mossi perintanto in tre: un operaio, un impiegato e un penzionato in rappresentanza di tutte le ‘ategorie ‘un ti dìo de’ morti di fame, ma ‘nzomma è guasi tutta gente che o paga le bollette o fa la spesa, e se fa la spesa ne pole fa’ onni giorno sempre di meno, perché i prezzi aomentano tutte le mattine ma li stipendi e le penzioni sono sempre li stessi, quando addirittura ‘un diminuiscano.   Sicché si son presentati cor vestito bono sotto palazzo Ghigi, a urlà “riforma fiscale un cazzo, qui mettilo mettilo chi lo piglia ‘nculo siamo sempre noi!”   La Meloni dé, s’è affacciata alla finestra, ‘un pareva ‘r Duce perché ‘un era ‘n montura ma ‘nzomma la postura  era quella, bazza ritta mani su’ fianchi e voce forte e atoritaria:   – Italiani! – s’è messa a urlà. – E se voi lo pigliate come sempre ‘nculo, ora però (…) Continua la lettura sul Vernacoliere in edicola oppure abbonati su shop.vernacoliere.comMa anche prima de’ sindaàti si son mossi perintanto in tre: un operaio, un impiegato e un penzionato in rappresentanza di tutte le ‘ategorie ‘un ti dìo de’ morti di fame, ma ‘nzomma è guasi tutta gente che o paga le bollette o fa la spesa, e se fa la spesa ne pole fa’ onni giorno sempre di meno, perché i prezzi aomentano tutte le mattine ma li stipendi e le penzioni sono sempre li stessi, quando addirittura ‘un diminuiscano.Sicché si son presentati cor vestito bono sotto palazzo Ghigi, a urlà “riforma fiscale un cazzo, qui mettilo mettilo chi lo piglia ‘nculo siamo sempre noi!”La Meloni dé, s’è affacciata alla finestra, ‘un pareva ‘r Duce perché ‘un era ‘n montura ma ‘nzomma la postura  era quella, bazza ritta mani su’ fianchi e voce forte e atoritaria:– Italiani! – s’è messa a urlà. – E se voi lo pigliate come sempre ‘nculo, ora però (…)
Senza peli sulla lingua	DUE FASCISMI PER  UN FASCISMO SOLO		In un paese omofobo e clericaleggiante come l’Italia, dove ora un governo di destra clericaleggiante e omofoba attacca persino i diritti civili più costituzionali, in tanti fra i cosiddetti benpensanti si chiedevano ironici, all’avvento meloniano, dove mai fossero i fascisti tanto paventati da sinistra, camicie nere e manganelli in mano.Ché di veder quelle e quelli ha bisogno tanta gente cosiddetta tranquilla e benpensante, per riconoscere i fascisti.Beh, così platealmente in piazza ancora non ci sono scesi, ma si stanno scaldando i muscoli. Vestiti magari con solo nereggianti giacconi e con bastoni diversi dai tradizionali manganelli, ma già si son fatti vivi, ora che l’aria di governo spira forte per loro. Dall’assalto alla CGIL di Roma al pestaggio squadristico di alcuni studenti di sinistra davanti a un liceo di Firenze – per citare qualche episodio fra i più evidenti –, dallo striscione “La Resistenza è una cagata pazzesca” appeso davanti a una scuola di Brescia fino alla dilettantesca società calcistica di Bergamo multata per aver esposto in campo la scritta “Cimitero mediteraneo, basta morti in mare” (…)
Vivo ’nteresse ner Paese per  l’anarchico ar 41 bisse  Persi 50 chili in 4 mesi!	ORA TUTTI VOGLIANO  LA DIETA  COSPITO!	La farà anche la Meloni?	di Mario Cardinali L’Italia ‘un aveva ancora ripreso fiato dopo Sarremo e ciaveva sempre nell’occhi ‘r ciuccione fra Fedez e Rosa Chemica ibò dé chissà come ni puzzava ‘r fiato, e già l’opinione pubbria s’è subito appassionata a un artro grande tema sociale, la dieta Cospito!    E capirai, cinquanta chili dimeno in neanche quattro mesi è roba da ‘nteressà un fottìo di gente perdavvero, con tutta la ciccia di troppo che c’è a giro!   Oddìo, a’ penzionati colla minima e a tutti vell’artri mortidifame che ora li chiamano novi poveri mapperò ci son sempre stati ‘un n’interessa magari un ber segone nulla delle diete, a loro per dimagrì a occhio ni basta digià ‘r caffellate per cena e a vorte anche a desinà, ma chi ‘nvece mangia regolarmente tutti i giorni e magari fa anche ‘r viottolo ar ristorante tipo l’onorevoli e tant’artri benestanti che s’ingozzano d’onni bendiddìo preparato magari anche da Cracco con quelle porzioncine che più che roba da fame son piatti da pottaioni gonfi di vaìni, ‘nzomma tutti lorolì e anche vell’artri che da Cracco ‘un ci vanno ma mangiano anche troppo uguale – oiòi guardavì che buzzo – hanno subito rizzato l’orecchi a sentì di quer Cospito ‘nzecchito a quer modo esagerato. (… ) Continua la lettura sul Vernacoliere in edicola oppure abbonati su shop.vernacoliere.comL’Italia ‘un aveva ancora ripreso fiato dopo Sarremo e ciaveva sempre nell’occhi ‘r ciuccione fra Fedez e Rosa Chemica ibò dé chissà come ni puzzava ‘r fiato, e già l’opinione pubbria s’è subito appassionata a un artro grande tema sociale, la dieta Cospito!E capirai, cinquanta chili dimeno in neanche quattro mesi è roba da ‘nteressà un fottìo di gente perdavvero, con tutta la ciccia di troppo che c’è a giro!Oddìo, a’ penzionati colla minima e a tutti vell’artri mortidifame che ora li chiamano novi poveri mapperò ci son sempre stati ‘un n’interessa magari un ber segone nulla delle diete, a loro per dimagrì a occhio ni basta digià ‘r caffellate per cena e a vorte anche a desinà, ma chi ‘nvece mangia regolarmente tutti i giorni e magari fa anche ‘r viottolo ar ristorante tipo l’onorevoli e tant’artri benestanti che s’ingozzano d’onni bendiddìo preparato magari anche da Cracco con quelle porzioncine che più che roba da fame son piatti da pottaioni gonfi di vaìni, ‘nzomma tutti lorolì e anche vell’artri che da Cracco ‘un ci vanno ma mangiano anche troppo uguale – oiòi guardavì che buzzo – hanno subito rizzato l’orecchi a sentì di quer Cospito ‘nzecchito a quer modo esagerato. (… )
Spaventi	TERRORISTE  ANCHE LE BOLLETTE!	Un urlo dar Paese  41 BISSE A CHI  RINCARA ’R GASSE!	di Mario Cardinali O vai che giorni addietro quarche pillaccherone s’è messo a dire dé, se ‘r 41 bisse l’hanno dato a Cospito pervìa che era un terrorista, allora ora n’andrebbe dato anche a chi spaventa la gente ‘olle bollette! Che quelle ‘un iscoppiano, ma ti fanno morì uguale!   Sicché dé, prima uno, poi dieci, poi cento e poi mille, è stato come quando varcuno dice luilì vedrai è un ber becco, e lui ‘un è più padrone di sortì di ‘asa che tutti ni dìano ‘un te lo mette ‘r cappello ‘n capo, tanto le ‘orna ti si vedano lostesso!   E così colle bollette! Ha principiato uno, poi due e poi tre, dopo du’ ore c’era digià i cortei per la strada a urlà 41 bisse a chi rincara ‘r gasse! Che poi la gente si sa, ni dai ‘r dito e ti pigliano ‘r braccio! – Ir gasse solo ’un basta! – tutti a sbraità dopo poìno. – Mettiamo ar carcere duro anche l’aomentatori di benzina e luce!   – E ‘r mi’ padrone di ‘asa, allora?! – s’è allargato un artro (…) Continua la lettura sul Vernacoliere in edicola oppure abbonati su shop.vernacoliere.comO vai che giorni addietro quarche pillaccherone s’è messo a dire dé, se ‘r 41 bisse l’hanno dato a Cospito pervìa che era un terrorista, allora ora n’andrebbe dato anche a chi spaventa la gente ‘olle bollette! Che quelle ‘un iscoppiano, ma ti fanno morì uguale!Sicché dé, prima uno, poi dieci, poi cento e poi mille, è stato come quando varcuno dice luilì vedrai è un ber becco, e lui ‘un è più padrone di sortì di ‘asa che tutti ni dìano ‘un te lo mette ‘r cappello ‘n capo, tanto le ‘orna ti si vedano lostesso!E così colle bollette! Ha principiato uno, poi due e poi tre, dopo du’ ore c’era digià i cortei per la strada a urlà 41 bisse a chi rincara ‘r gasse!– Ir gasse solo ’un basta! – tutti a sbraità dopo poìno. – Mettiamo ar carcere duro anche l’aomentatori di benzina e luce!
GIUSTIZIA	AIUTIAMO NORDIO!  COMPRIAMONI UN  TRIBUNALE TUTTO SUO!	Così la smette di rompere i coglioni a quell’artri!	Povero Carlo Nordio! Sì, va bene, si sa che da quando la Meloni l’ha fatto Ministro della Giustizia s’è fissato di voler riformare tutto, a principiare dalle intercettazioni telefoniche su chi viene indagato che gli stanno proprio sul buzzo, si sa che gli piacerebbe levarle di mezzo e pazienza se gli altri magistrati lo guardano storto, come pure vorrebbe eliminare l’abuso d’ufficio, principale reato dei colletti bianchi che invece per lui vanno lasciati fare, un po’ come la Meloni vuol lasciar fare chi fa, e se fa i soliti intrallazzi pazienza, si vedrà poi.E rivuole anche l’immunità parlamentare per gli onorevoli, il nostro Carlo Nordio (…)
Senza peli sulla lingua	TEMPI DI ODIO  E DI DISGUSTO		E dunque anche l’Europa – quel pavesato gran consesso di politici e burocrati diuturnamente intesi agl’interessi forti dei propri fortissimi mandanti gabellati per gl’interessi dell’intera Unione – ha aperto ufficialmente ai muri contro gl’immigrati cosiddetti clandestini, chi scappa cioè da guerre e fame senza i richiesti timbri attestanti fame e disperazione.A trionfo infine di quanti nella stessa Europa, e sono diecine di Stati a principiar dall’Ungheria d’Orbàn, hanno già alzato invalicabili barriere di filo spinato, mentre l’Italia meloniana aspira specialmente a blocchi navali, distesa com’è in mezzo al mare.E l’odio per gli sventurati trabocca e cola da consessi cosiddetti civili, e s’ammanta pure d’ipocrisia istituzionale nel proibire alle navi di soccorso, come ha proibito l’Italia meloniana, più d’un salvataggio alla volta di migranti stipati nei barconi, pur anche nel mare in tempesta, contro ogni regola di diritto marittimo e d’umanità. Magari spacciando per intento salvifico (meno s’imbarcheranno e meno ne affogheranno) un legiferato impedimento alla salvezza di vite umane. (…)
L'editoriale - Senza peli sulla lingua	IL MOTORE DELLA CORRUZIONE		di Mario Cardinali Povero PD! Era lì in pieno travaglio ideologico a cercar se stesso, e chiedeva in giro “Mi avete mica visto da qualche parte?”, o vai che qualcuno ha detto sì sì, t’hanno beccato dalle parti del Qatargate!   Nemmeno il tempo di riaversi dalla meravigliata sorpresa, ed eccogli addosso sfottò e versacci, povero PD, e tutti a dirgli me la saluti ora la superiorità morale della Sinistra!   Perché la gente è credulona, credeva ancora che ci fosse una Sinistra, non pensava che anche il PD fosse diventato un partito neoliberale di politica e d’affari, e che la mitica memoria d’un Berlinguer fosse ormai roba d’altri tempi.   E non lo sapeva mica, la gente, che la corruzione si chiama così soltanto quando deborda dai limiti di legge e di buonsenso, come buonsenso certo non era il farsi trovare valigette piene di contanti in casa, lo sanno anche i bimbi che prima regola del cittadino almeno un poco furbo è pensare non dico proprio alle Bahamas, roba da ricchi com’è, ma a qualche nascondiglio quantomeno fuorimano, una buca in terra, tò, che lì spesso la polizia non ci trova nemmeno i morti strangolati.   E i limiti di legge, chi gliene parla alla gente? Mica lo sanno, i comuni mortali, che anche il Parlamento Europeo è pieno di lobbisti (ce ne son dodicimila ufficialmente accreditati a Bruxelles), quella gente cioè che va a far gl’interessi delle grandi aziende produttrici specialmente d’armi, di roba alimentare e d’energia, e mica li convincono a discorsi o a mazzi di fiori i deputati che possono far certi favori… (…) Continua la lettura sul Vernacoliere in edicola oppure abbonati su shop.vernacoliere.comPovero PD! Era lì in pieno travaglio ideologico a cercar se stesso, e chiedeva in giro “Mi avete mica visto da qualche parte?”, o vai che qualcuno ha detto sì sì, t’hanno beccato dalle parti del Qatargate!Nemmeno il tempo di riaversi dalla meravigliata sorpresa, ed eccogli addosso sfottò e versacci, povero PD, e tutti a dirgli me la saluti ora la superiorità morale della Sinistra!Perché la gente è credulona, credeva ancora che ci fosse una Sinistra, non pensava che anche il PD fosse diventato un partito neoliberale di politica e d’affari, e che la mitica memoria d’un Berlinguer fosse ormai roba d’altri tempi.E non lo sapeva mica, la gente, che la corruzione si chiama così soltanto quando deborda dai limiti di legge e di buonsenso, come buonsenso certo non era il farsi trovare valigette piene di contanti in casa, lo sanno anche i bimbi che prima regola del cittadino almeno un poco furbo è pensare non dico proprio alle Bahamas, roba da ricchi com’è, ma a qualche nascondiglio quantomeno fuorimano, una buca in terra, tò, che lì spesso la polizia non ci trova nemmeno i morti strangolati.E i limiti di legge, chi gliene parla alla gente? Mica lo sanno, i comuni mortali, che anche il Parlamento Europeo è pieno di lobbisti (ce ne son dodicimila ufficialmente accreditati a Bruxelles), quella gente cioè che va a far gl’interessi delle grandi aziende produttrici specialmente d’armi, di roba alimentare e d’energia, e mica li convincono a discorsi o a mazzi di fiori i deputati che possono far certi favori… (…)
Agenda Meloni  POLIZIA MORALE  anticomunista!	TAGLIANO L’UCCELLO  A CHI CIA’ LA  CAPPELLA  ROSSA!	E stiacciano le palle  a chi ’un ce l’ha nere!	Vivissima ‘nquetudine ha destato in tutte l’anime demogràtie ’r gravissimo episodio dell’artro giorno, ‘ndove arcuni tizzi tutti vestiti da pulizziotti, ma no della normale PS, hanno fermato per la strada un passante a caso, e n’hanno ‘ntimato di fanni vedé l’uccello!– Perché noi ‘r rosso ‘un si pole patì di soffrì, è roba ‘mmorale perdavvero! E lei ‘un faccia tanto ‘r furbino, perché sennò ni si guarda anche le palle, e s’un cel’ha nere ni si stiacciano co’ piedi!– Ci stiacciano le palle, ci stiacciano le palle! – tutti quelli der Piddì a urlà. – La Meloni vole levà la dignità alla sinistra!Di modo e maniera hanno fatto un’interrogazzione urgente alla Meloni per la strada siccome ar chiuso lei i giornalisti ‘un li càa nemmeno (… )
Qatarghèit	LA MAFIA QUERELA  ’R PARLAMENTO UROPEO!	“Ci rubano ’l lavoro!”	di Mario Cardinali Cosanostra l’ha detto chiaro e tondo: “Qui, s’un ci si fa sentì, ci lasciano ‘n mutande!”   Dettofatto uno de’ Mammasantissima dell’Onorata Socetà ha telefanato di volata a uno de’ Mammasantissima di quell’artra Socetà onorata anche lei, che a vorte quarcuno si picca a chiamà Stato.   – Sicché te ‘un sapevi nulla di tutto vesto mangiamangia der Parlamento Uropeo?!   – Dici le mazzete der Qatar? ‘Un dipende mìa da noi!   – Però tanti di velli che mangiano sono italiani, quarcosa ci potreste fa’!   – Ma io?! Te sbarelli, qui lo scandalo è troppo grosso, bisogna andacci di scartina!   – Ma a noi ‘ntanto ci rubano ‘l lavoro! – E vabbene, vorrà dire che poi vi si farà beccà dipiù cor ponte sullo Stretto!   – Sì, aspetta e spera! Noi, lo sai, i milioni si vogliano sull’unghia!   – E questa vorta ‘nvece l’unghie ve le dovete taglià un poìno, s‘un volete sputtanà anche la gente perbene!    – E sareste te quello perbene?! Se apro bocca io… (…)  Continua la lettura sul Vernacoliere in edicola oppure abbonati su shop.vernacoliere.comCosanostra l’ha detto chiaro e tondo: “Qui, s’un ci si fa sentì, ci lasciano ‘n mutande!”Dettofatto uno de’ Mammasantissima dell’Onorata Socetà ha telefanato di volata a uno de’ Mammasantissima di quell’artra Socetà onorata anche lei, che a vorte quarcuno si picca a chiamà Stato.– Sicché te ‘un sapevi nulla di tutto vesto mangiamangia der Parlamento Uropeo?!– Ma io?! Te sbarelli, qui lo scandalo è troppo grosso, bisogna andacci di scartina!– E vabbene, vorrà dire che poi vi si farà beccà dipiù cor ponte sullo Stretto!– E questa vorta ‘nvece l’unghie ve le dovete taglià un poìno, s‘un volete sputtanà anche la gente perbene!Continua la lettura sul Vernacoliere in edicola oppure abbonati su shop.vernacoliere.com
Ortraggio alla demograzzia!	GIGANTESCO RUTO  SPETTINA SGARBI!	Era lì che ragionava, n’è arrivata  ‘na fiatata l’ha sdraiato!	L’atto in sé non sarebbe così grave (emissione buccale d’aria gastrica con rumoroso suono tipico proprio dei rutti, detti ruti in livornese), se non s’instaurasse nel clima d’odio scatenato dalla Sinistra contro Giorgia Meloni e i rappresentanti del suo governo, da molti ritenuto, con i suoi tanti Fratelli d’Italia, un esecutivo di evidente Destra postfascista.Nella quale Destra viene ora considerato anche Vittorio Sgarbi, approdato tra i Fratelli d’Italia di governo come nuovo sottosegretario alla Cultura dopo le sue tante storiche peregrinazioni da un partito all’altro, nell’inquieta sua ricerca d’uno scopo nella vita, oltre all’Arte.E proprio Sgarbi giorni addietro era lì che passeggiava tranquillo, ignaro di tanto agguato (…)
NATALE Ir novo Presepio patriòttio	GIUSEPPE IN CAMICIA NERA LA MADONNA ALLA ‘ONCA	e Gesubbambino vestito da Balilla E per riscardassi, la fiamma triolore!	O vai l’artro giorno t’è arrivato quer popò di furgone lungo di vì a laggiù, c’era uno collo ‘mbuto ‘n bocca urlava “Italiani, la Patria vi chiama!” La gente dé, tutti a guardassi l’un coll’artro! – Io ‘un ho sentito nulla! – diceva uno. – Te t’ha chiamato? – Macché, neanch’io! – rispondeva un artro. E così quell’artri, tutti a di’ ma vedrai luilì è briao! – Quell’omo, – n’ha fatto ‘na donna – ma la Patria sa assai ‘ome mi chiamo, o come fa a chiamammi? E ‘nzomma la solita storia di vando la gente ‘un si fida! Di vesti tempi poi, che te magari rispondi sì ar telefanino e ti ritrovi a culognudo senza più neanche le mutande! – Sissì, è successo anche alla mi’ ognata, a lei però le mutande niel’ha levate uno di passaggio! – Boia! E menomale era di passaggio! Se si fermava, capace la trombava! – E l’ha trombata, ‘un dubità! Ir mi’ fratello però niel’ha detto, ‘un ti devi mai fidà delli sconosciuti! Quello dello ‘mbuto frattanto seguitava: – Italiani, venite a vedé ‘r novo Presepio patriòttio! È un’inizziativa der Ministero per ir Reupero delle Sane Tradizzioni d’una vorta, ‘un si paga nulla! (… )Continua la lettura sul Vernacoliere in edicola oppure abbonati su shop.vernacoliere.com
